Candidate,Party,State,Office,Incumbency,Result,Total Money
"BALLOU JR, DANIEL H",REPUBLICAN,MA,HOUSE DISTRICT NINETEENTH MIDDLESEX,Challenger,Lost-General,5744.73
"KOCZERA, ROBERT M",DEMOCRATIC,MA,HOUSE DISTRICT ELEVENTH BRISTOL,Incumbent,Won-General,5593.22
"LEARY JR, RAYMOND P",LIBERTARIAN,MA,HOUSE DISTRICT SEVENTH BRISTOL,Challenger,Lost-General,5450.76
"FOX, GLORIA",DEMOCRATIC,MA,HOUSE DISTRICT SEVENTH SUFFOLK,Incumbent,Won-General,5150.00
"CASHMAN, MICHAEL P",REPUBLICAN,MA,HOUSE DISTRICT FIFTH MIDDLESEX,Challenger,Lost-General,5130.00
"HAZELTON III, ROBERT G",REPUBLICAN,MA,HOUSE DISTRICT FIFTEENTH ESSEX,Challenger,Lost-General,4902.00
"TURKINGTON, ERIC T",DEMOCRATIC,MA,"HOUSE DISTRICT BARNSTABLE, DUKES AND NANTUCKET",Incumbent,Won-General,4325.00
"KRIEGER, CLIFFORD R",REPUBLICAN,MA,HOUSE DISTRICT SEVENTEENTH MIDDLESEX,Challenger,Lost-General,4060.40
"RUSHING, BYRON",DEMOCRATIC,MA,HOUSE DISTRICT NINTH SUFFOLK,Incumbent,Won-General,4045.00
"SPRAGUE, JO ANN",REPUBLICAN,MA,SENATE DISTRICT BRISTOL AND NORFOLK,Incumbent,Won-General,3683.45
"ALDRED, JAMES J",REPUBLICAN,MA,HOUSE DISTRICT SEVENTH NORFOLK,Challenger,Lost-General,3324.33
"GOMES, SHIRLEY A",REPUBLICAN,MA,HOUSE DISTRICT FOURTH BARNSTABLE,Incumbent,Won-General,3317.49
"HANSEN, HOWARD",REPUBLICAN,MA,HOUSE DISTRICT SIXTH NORFOLK,Challenger,Lost-General,3276.20
"FINNERAN, ROBERT V",REPUBLICAN,MA,HOUSE DISTRICT SECOND ESSEX,Challenger,Lost-General,3216.00
"HAGAN, WILLIAM J",REPUBLICAN,MA,HOUSE DISTRICT FOURTH MIDDLESEX,Challenger,Lost-General,3117.04
"STORY, ELLEN",DEMOCRATIC,MA,HOUSE DISTRICT THIRD HAMPSHIRE,Incumbent,Won-General,3029.02
"OLSON, STEVEN P",LIBERTARIAN,MA,HOUSE DISTRICT SEVENTH PLYMOUTH,Challenger,Lost-General,2770.00
"DE PIETRO, ALFRED J",UNENROLLED,MA,HOUSE DISTRICT EIGHTEENTH ESSEX,Open,Lost-General,2660.00
"WHITE, PETER T",GREEN,MA,HOUSE DISTRICT SECOND BARNSTABLE,Challenger,Lost-General,2476.00
"GAGNE, JAMES A",REPUBLICAN,MA,HOUSE DISTRICT FIRST FRANKLIN,Challenger,Lost-General,2420.46
"PILLSBURY, JAMES M",LIBERTARIAN,MA,HOUSE DISTRICT SIXTH MIDDLESEX,Challenger,Lost-General,2420.16
"CARBONEAU, JAMES P",DEMOCRATIC,MA,HOUSE DISTRICT EIGHTH MIDDLESEX,Challenger,Lost-General,2230.00
"GARAVANIAN, HARRY H",REPUBLICAN,MA,HOUSE DISTRICT SIXTEENTH MIDDLESEX,Challenger,Lost-General,2221.00
"BARTONE, SUE",GREEN,MA,HOUSE DISTRICT SECOND HAMPSHIRE,Open,Lost-General,2187.65
"RONUKAITUS, PAUL J",REPUBLICAN,MA,HOUSE DISTRICT NINETEENTH SUFFOLK,Challenger,Lost-General,2148.39
"LYMAN, BROOKS T",REPUBLICAN,MA,SENATE DISTRICT FIRST MIDDLESEX,Challenger,Lost-General,2147.75
"MCMAHON, CAROLYN",LIBERTARIAN,MA,"SENATE DISTRICT WORCESTER, HAMPDEN, HAMPSHIRE AND FRANKLIN",Challenger,Lost-General,1924.64
"FAIN, DANNY",LIBERTARIAN,MA,HOUSE DISTRICT ELEVENTH MIDDLESEX,Challenger,Lost-General,1916.00
"CHIDI JR, GEORGE A",UNENROLLED,MA,HOUSE DISTRICT FIFTEENTH SUFFOLK,Open,Lost-General,1915.00
"YEAW, AIDAN T",UNENROLLED,MA,HOUSE DISTRICT SIXTEENTH WORCESTER,Challenger,Lost-General,1692.81
"CHAROW JR, JOHN W",REPUBLICAN,MA,HOUSE DISTRICT EIGHTEENTH MIDDLESEX,Challenger,Lost-General,1596.83
"PACHECO, WILLIAM D (SKIP)",LIBERTARIAN,MA,HOUSE DISTRICT TWELFTH WORCESTER,Challenger,Lost-General,1520.00
"RODERICK, JOHN ALAN",LIBERTARIAN,MA,HOUSE DISTRICT TWENTY-SEVENTH MIDDLESEX,Challenger,Lost-General,1312.62
"MANGANELLO, VINCENT J",REPUBLICAN,MA,SENATE DISTRICT FIRST SUFFOLK AND MIDDLESEX,Challenger,Lost-General,1120.00
"WILCOX, ALAN L",LIBERTARIAN,MA,HOUSE DISTRICT SECOND HAMPDEN,Challenger,Lost-General,832.39
"YAMPELL, RICHARD ALAN",LIBERTARIAN,MA,HOUSE DISTRICT SIXTH NORFOLK,Challenger,Lost-General,793.90
"PAGLIA, DONATO H",UNENROLLED,MA,HOUSE DISTRICT SIXTH ESSEX,Open,Lost-General,774.44
"CHOATE, CHARLES F",REPUBLICAN,MA,HOUSE DISTRICT FIFTH ESSEX,Challenger,Lost-General,750.00
"ISRAEL, ELIAS",LIBERTARIAN,MA,HOUSE DISTRICT TWENTY-FIRST MIDDLESEX,Challenger,Lost-General,625.00
"FOLEY, WILLIAM P",INDEPENDENT,MA,"SENATE DISTRICT BERKSHIRE, HAMPSHIRE AND FRANKLIN",Challenger,Lost-General,500.00
"BOSTON, ERYK C",LIBERTARIAN,MA,HOUSE DISTRICT SEVENTEENTH MIDDLESEX,Challenger,Lost-General,480.00
"TESTAGROSSA, MARK P",LIBERTARIAN,MA,HOUSE DISTRICT FOURTH MIDDLESEX,Challenger,Lost-General,274.34
"DEVANEY, MARILYN PETITTO",DEMOCRATIC,MA,EXECUTIVE COUNCILOR DISTRICT 003,Incumbent,Won-General,200.00
"TIMILTY, WALTER F",DEMOCRATIC,MA,HOUSE DISTRICT SEVENTH NORFOLK,Incumbent,Won-General,-200.00
"OBRIEN, EDWARD M",DEMOCRATIC,MA,EXECUTIVE COUNCILOR DISTRICT 008,Incumbent,Won-General,-19000.00
"PEREZ, RALPH",REPUBLICAN,MA,SENATE DISTRICT WORCESTER AND NORFOLK,Challenger,Lost-General,0.00
"BERDOS JR, GEORGE L",LIBERTARIAN,MA,HOUSE DISTRICT EIGHTH PLYMOUTH,Challenger,Lost-General,0.00
"CHAPARRO, PEGGY",INDEPENDENT,MA,HOUSE DISTRICT FIFTH SUFFOLK,Challenger,Lost-General,0.00
"CLIFFORD, JOHN H",INDEPENDENT,MA,HOUSE DISTRICT FIFTEENTH SUFFOLK,Open,Lost-General,0.00
"XENAKIS, JOHN JAMES",INDEPENDENT,MA,AUDITOR,Challenger,Lost-General,0.00
"GODDARD, MATTHEW",GRASSROOTS,MA,HOUSE DISTRICT SECOND BERKSHIRE,Challenger,Lost-General,0.00
"CIAMPA, VINCENT PAUL",DEMOCRATIC,MA,HOUSE DISTRICT THIRTY-FOURTH MIDDLESEX,Incumbent,Won-General,0.00
"SULLIVAN, JOSEPH C",DEMOCRATIC,MA,HOUSE DISTRICT FIFTH NORFOLK,Incumbent,Won-General,0.00
"CALLAHAN, MICHAEL J",DEMOCRATIC,MA,EXECUTIVE COUNCILOR DISTRICT 006,Incumbent,Won-General,0.00
"MCMANUS, DENNIS P",DEMOCRATIC,MA,EXECUTIVE COUNCILOR DISTRICT 007,Incumbent,Won-General,0.00
"STEIN, JILL ELLEN",GREEN-RAINBOW,MA,GOVERNOR,Open,Won-Primary,0.00
"LORENZEN, ANTHONY F",GREEN-RAINBOW,MA,LIEUTENANT GOVERNOR,Open,Won-Primary,0.00
"AUCOIN, RICHARD P",LIBERTARIAN,MA,LIEUTENANT GOVERNOR,Open,Won-Primary,0.00
"JOHNSON, BARBARA C & SCHEBEL, JOSEPH F",UNENROLLED,MA,GOVERNOR / LIEUTENANT GOVERNOR,Open,Lost-General,0.00
"OBRIEN, SHANNON P",DEMOCRATIC,MA,GOVERNOR,Open,Won-Primary,0.00
"ROMNEY, WILLARD MITT",REPUBLICAN,MA,GOVERNOR,Open,Won-Primary,0.00
"GABRIELI, CHRISTOPHER F",DEMOCRATIC,MA,LIEUTENANT GOVERNOR,Open,Won-Primary,0.00
"HEALEY, KERRY MURPHY",REPUBLICAN,MA,LIEUTENANT GOVERNOR,Open,Won-Primary,0.00
