Candidate,Party,State,Office,Incumbency,Result,Total Money
"HENRIQUEZ, CARLOS TONY",DEMOCRATIC,MA,HOUSE DISTRICT FIFTH SUFFOLK,Incumbent,Won-General,13984.64
"ZENKIN, WALTER",REPUBLICAN,MA,HOUSE DISTRICT TWENTY-FIRST MIDDLESEX,Open,Lost-General,13734.62
"LAUGENOUR, LEE SCOTT",GREEN-RAINBOW,MA,HOUSE DISTRICT FOURTH BERKSHIRE,Challenger,Lost-General,13701.99
"VACON, LINDA",REPUBLICAN,MA,HOUSE DISTRICT FIFTH HAMPDEN,Open,Lost-General,13694.44
"SPILIOTIS, JOYCE A",DEMOCRATIC,MA,HOUSE DISTRICT TWELFTH ESSEX,Incumbent,Won-General,13525.00
"FERGUSON, KIMBERLY N",REPUBLICAN,MA,HOUSE DISTRICT FIRST WORCESTER,Incumbent,Won-General,13265.00
"BOTELHO, DANIEL S",INDEPENDENT,MA,US HOUSE DISTRICT MA 009,Challenger,Lost-General,12778.48
"CANAVAN, CHRISTINE E",DEMOCRATIC,MA,HOUSE DISTRICT TENTH PLYMOUTH,Incumbent,Won-General,12753.24
"CONROY, THOMAS P",DEMOCRATIC,MA,HOUSE DISTRICT THIRTEENTH MIDDLESEX,Incumbent,Won-General,11842.04
"SIMONIAN, STEPHEN R",REPUBLICAN,MA,SENATE DISTRICT SECOND WORCESTER,Challenger,Lost-General,11573.05
"BENN, MICHAEL J",REPUBLICAN,MA,HOUSE DISTRICT FOURTEENTH MIDDLESEX,Challenger,Lost-General,11236.44
"MANNAL, BRIAN RICHARD",DEMOCRATIC,MA,HOUSE DISTRICT SECOND BARNSTABLE,Open,Won-General,10945.58
"MADDEN, TIMOTHY",DEMOCRATIC,MA,"HOUSE DISTRICT BARNSTABLE, DUKES AND NANTUCKET",Incumbent,Won-General,10828.24
"FRANCO, MICHAEL",REPUBLICAN,MA,EXECUTIVE COUNCILOR DISTRICT 008,Open,Lost-General,10605.00
"PETRAITIS, JASON M",REPUBLICAN,MA,HOUSE DISTRICT FIFTH WORCESTER,Challenger,Lost-General,10560.00
"GOBI, ANNE",DEMOCRATIC,MA,HOUSE DISTRICT FIFTH WORCESTER,Incumbent,Won-General,10448.24
"ODONNELL, JAMES",UNENROLLED,MA,HOUSE DISTRICT TWENTY-SECOND MIDDLESEX,Challenger,Lost-General,10235.00
"DAVIS, GENEVIEVE S",DEMOCRATIC,MA,SENATE DISTRICT PLYMOUTH AND NORFOLK,Challenger,Lost-General,9980.66
"BENNETT, DANIEL C",REPUBLICAN,MA,HOUSE DISTRICT THIRTEENTH ESSEX,Challenger,Lost-General,9864.84
"TURNER, CLEON H",DEMOCRATIC,MA,HOUSE DISTRICT FIRST BARNSTABLE,Incumbent,Won-General,9722.49
"BENSON, JENNIFER E",DEMOCRATIC,MA,HOUSE DISTRICT THIRTY-SEVENTH MIDDLESEX,Incumbent,Won-General,9415.00
"FISHMAN, DANIEL",LIBERTARIAN,MA,US HOUSE DISTRICT MA 006,Challenger,Lost-General,7607.00
"CURRAN, SEAN",DEMOCRATIC,MA,HOUSE DISTRICT NINTH HAMPDEN,Incumbent,Won-General,7528.24
"CARUCCIO, PAUL A",REPUBLICAN,MA,HOUSE DISTRICT NINETEENTH SUFFOLK,Challenger,Lost-General,6780.00
"SMIZIK, FRANK",DEMOCRATIC,MA,HOUSE DISTRICT FIFTEENTH NORFOLK,Incumbent,Won-General,6598.24
"CARIDDI, GAILANNE M",DEMOCRATIC,MA,HOUSE DISTRICT FIRST BERKSHIRE,Incumbent,Won-General,6589.48
"KUNIEWICH JR, CHUCK S",REPUBLICAN,MA,HOUSE DISTRICT THIRD MIDDLESEX,Challenger,Lost-General,5814.00
"VASCONCELOS, THOMAS MICHAEL",REPUBLICAN,MA,HOUSE DISTRICT TWENTY-SIXTH MIDDLESEX,Challenger,Lost-General,5312.79
"BLACKIE, LINCOLN",INDEPENDENT,MA,HOUSE DISTRICT SIXTH HAMPDEN,Challenger,Lost-General,5263.84
"LEBEAU, WILLIAM G",REPUBLICAN,MA,HOUSE DISTRICT SEVENTEENTH WORCESTER,Challenger,Lost-General,4788.68
"MCCARTHY, DENNIS JOHN",REPUBLICAN,MA,HOUSE DISTRICT TWELFTH HAMPDEN,Challenger,Lost-General,4746.07
"STANTON III, FRANCIS XAVIER",REPUBLICAN,MA,HOUSE DISTRICT TENTH MIDDLESEX,Challenger,Lost-General,4087.13
"BURKE, MARTIN D",REPUBLICAN,MA,HOUSE DISTRICT SEVENTEENTH MIDDLESEX,Challenger,Lost-General,3686.50
"BUBA, JAMES J",REPUBLICAN,MA,SENATE DISTRICT FIRST MIDDLESEX,Challenger,Lost-General,3526.00
"DOOLEY III, THOMAS J",REPUBLICAN,MA,SENATE DISTRICT FIRST SUFFOLK AND MIDDLESEX,Challenger,Lost-General,3515.00
"CONNOLLY, MIKE",OTHER,MA,HOUSE DISTRICT TWENTY-SIXTH MIDDLESEX,Challenger,Lost-General,3344.38
"FERNANDES, JOHN V",DEMOCRATIC,MA,HOUSE DISTRICT TENTH WORCESTER,Incumbent,Won-General,2953.24
"AYLWARD, STEVEN W",REPUBLICAN,MA,SENATE DISTRICT SECOND SUFFOLK AND MIDDLESEX,Challenger,Lost-General,2852.42
"HOBERT, JEROME",GREEN,MA,HOUSE DISTRICT FIFTH HAMPDEN,Open,Lost-General,2765.00
"OMALLEY, BRIAN J",REPUBLICAN,MA,HOUSE DISTRICT FIFTEENTH WORCESTER,Open,Lost-General,2270.73
"GARRISON, ALTHEA",OTHER,MA,HOUSE DISTRICT FIFTH SUFFOLK,Challenger,Lost-General,2176.14
"SHEFF, THOMAS",UNENROLLED,MA,EXECUTIVE COUNCILOR DISTRICT 003,Challenger,Lost-General,1502.64
"UNDERWOOD, ROBERT J",UNENROLLED,MA,HOUSE DISTRICT NINTH HAMPDEN,Challenger,Lost-General,1383.32
"CIPOLLINI, CHARLES OLIVER",REPUBLICAN,MA,EXECUTIVE COUNCILOR DISTRICT 001,Incumbent,Lost-General,1000.00
"KLAUDER, CHARLES F",REPUBLICAN,MA,HOUSE DISTRICT SECOND SUFFOLK,Challenger,Lost-General,898.52
"THOMAS, ROBERT MONTGOMERY",CONSTITUTIONAL AMERICAN,MA,HOUSE DISTRICT FOURTH NORFOLK,Challenger,Lost-General,299.98
"JOLITZ, RICHARD A",REPUBLICAN,MA,SENATE DISTRICT SECOND ESSEX,Open,Lost-General,254.91
"SCHOBER, RICHARD",INDEPENDENT,MA,HOUSE DISTRICT SECOND FRANKLIN,Challenger,Lost-General,210.86
"RUSHING, BYRON",DEMOCRATIC,MA,HOUSE DISTRICT NINTH SUFFOLK,Incumbent,Won-General,125.00
"HANDY, WINTHROP",INDEPENDENT,MA,HOUSE DISTRICT FOURTEENTH WORCESTER,Challenger,Lost-General,100.00
"RAJCZEWSKI, DAVID M",REPUBLICAN,MA,HOUSE DISTRICT THIRTY-FOURTH MIDDLESEX,Challenger,Lost-General,35.00
"FARLEY-BOUVIER, TRICIA",DEMOCRATIC,MA,HOUSE DISTRICT THIRD BERKSHIRE,Incumbent,Won-General,-3100.00
"SHOLLEY, EARL HENRY",REPUBLICAN,MA,EXECUTIVE COUNCILOR DISTRICT 002,Open,Lost-General,0.00
"SANTIAGO, JOSE",UNENROLLED,MA,HOUSE DISTRICT SIXTEENTH ESSEX,Challenger,Lost-General,0.00
"OLIVER, NORMAN W",INDEPENDENT,MA,HOUSE DISTRICT ELEVENTH HAMPDEN,Challenger,Lost-General,0.00
"ROMERO, KARLA",INDEPENDENT,MA,US HOUSE DISTRICT MA 007,Challenger,Lost-General,0.00
"ROSA, DAVID A",INDEPENDENT,MA,US HOUSE DISTRICT MA 004,Open,Lost-General,0.00
