Candidate,Party,State,Office,Incumbency,Result,Total Money
"WARREN, ELIZABETH A",DEMOCRATIC,MA,US SENATE DISTRICT MA SW-CLASS I,Challenger,Won-General,43046560.54
"BROWN, SCOTT P",REPUBLICAN,MA,US SENATE DISTRICT MA SW-CLASS I,Incumbent,Lost-General,29449785.36
"KENNEDY III, JOSEPH P",DEMOCRATIC,MA,US HOUSE DISTRICT MA 004,Open,Won-General,4261875.31
"TISEI, RICHARD R",REPUBLICAN,MA,US HOUSE DISTRICT MA 006,Challenger,Lost-General,2350087.63
"TIERNEY, JOHN F",DEMOCRATIC,MA,US HOUSE DISTRICT MA 006,Incumbent,Won-General,2123328.91
"NEAL, RICHARD E",DEMOCRATIC,MA,US HOUSE DISTRICT MA 001,Incumbent,Won-General,1770371.81
"TSONGAS, NICOLA S (NIKI)",DEMOCRATIC,MA,US HOUSE DISTRICT MA 003,Incumbent,Won-General,1553960.04
"MARKEY, EDWARD J",DEMOCRATIC,MA,US HOUSE DISTRICT MA 005,Incumbent,Won-General,1390343.19
"MCGOVERN, JAMES P",DEMOCRATIC,MA,US HOUSE DISTRICT MA 002,Incumbent,Won-General,1085354.35
"KEATING, WILLIAM RICHARD",DEMOCRATIC,MA,US HOUSE DISTRICT MA 009,Incumbent,Won-General,1067310.00
"BIELAT, SEAN",REPUBLICAN,MA,US HOUSE DISTRICT MA 004,Open,Lost-General,1060815.77
"CAPUANO, MICHAEL E",DEMOCRATIC,MA,US HOUSE DISTRICT MA 007,Incumbent,Won-General,903602.97
"MURRAY, THERESE",DEMOCRATIC,MA,SENATE DISTRICT PLYMOUTH AND BARNSTABLE,Incumbent,Won-General,867190.02
"DELEO, ROBERT A",DEMOCRATIC,MA,HOUSE DISTRICT NINETEENTH SUFFOLK,Incumbent,Won-General,861111.49
"LYNCH, STEPHEN F",DEMOCRATIC,MA,US HOUSE DISTRICT MA 008,Incumbent,Won-General,725009.35
"FINEGOLD, BARRY R",DEMOCRATIC,MA,SENATE DISTRICT SECOND ESSEX AND MIDDLESEX,Incumbent,Won-General,431912.55
"HART JR, JOHN A (JACK)",DEMOCRATIC,MA,SENATE DISTRICT FIRST SUFFOLK,Incumbent,Won-General,297235.00
"DEMPSEY, BRIAN S",DEMOCRATIC,MA,HOUSE DISTRICT THIRD ESSEX,Incumbent,Won-General,286531.74
"JUBINVILLE, ROBERT L",DEMOCRATIC,MA,EXECUTIVE COUNCILOR DISTRICT 002,Open,Won-General,273285.82
"GOLNIK, JONATHAN A",REPUBLICAN,MA,US HOUSE DISTRICT MA 003,Challenger,Lost-General,248685.00
"DOWNING, BENJAMIN BRACKETT",DEMOCRATIC,MA,"SENATE DISTRICT BERKSHIRE, HAMPSHIRE, FRANKLIN AND HAMPDEN",Incumbent,Won-General,237373.75
"ELDRIDGE, JAMES B",DEMOCRATIC,MA,SENATE DISTRICT MIDDLESEX AND WORCESTER,Incumbent,Won-General,235246.41
"MARIANO, RONALD",DEMOCRATIC,MA,HOUSE DISTRICT THIRD NORFOLK,Incumbent,Won-General,217622.86
"BARRETT, MICHAEL J",DEMOCRATIC,MA,SENATE DISTRICT THIRD MIDDLESEX,Open,Won-General,210945.13
"WOLF, DANIEL A",DEMOCRATIC,MA,SENATE DISTRICT CAPE AND ISLANDS,Incumbent,Won-General,208152.70
"WALSH, MARTIN J",DEMOCRATIC,MA,HOUSE DISTRICT THIRTEENTH SUFFOLK,Incumbent,Won-General,207999.11
"MOORE, MICHAEL O",DEMOCRATIC,MA,SENATE DISTRICT SECOND WORCESTER,Incumbent,Won-General,206957.74
"LOVELY, JOAN B",DEMOCRATIC,MA,SENATE DISTRICT SECOND ESSEX,Open,Won-General,205612.38
"PETRUCCELLI, ANTHONY W",DEMOCRATIC,MA,SENATE DISTRICT FIRST SUFFOLK AND MIDDLESEX,Incumbent,Won-General,202590.68
"COSTELLO, MICHAEL A",DEMOCRATIC,MA,HOUSE DISTRICT FIRST ESSEX,Incumbent,Won-General,200666.00
"JOYCE, BRIAN A",DEMOCRATIC,MA,"SENATE DISTRICT NORFOLK, BRISTOL AND PLYMOUTH",Incumbent,Won-General,194161.94
"DIDOMENICO, SALVATORE N",DEMOCRATIC,MA,SENATE DISTRICT MIDDLESEX & SUFFOLK,Incumbent,Won-General,193098.98
"MOORE, RICHARD T",DEMOCRATIC,MA,SENATE DISTRICT WORCESTER AND NORFOLK,Incumbent,Won-General,191899.53
"RODRIGUES, MICHAEL J",DEMOCRATIC,MA,SENATE DISTRICT FIRST BRISTOL AND PLYMOUTH,Incumbent,Won-General,190628.47
"KEYES, THOMAS FRANCIS",REPUBLICAN,MA,SENATE DISTRICT PLYMOUTH AND BARNSTABLE,Challenger,Lost-General,165234.64
"KEENAN, JOHN D",DEMOCRATIC,MA,HOUSE DISTRICT SEVENTH ESSEX,Incumbent,Won-General,158337.65
"MICHLEWITZ, AARON",DEMOCRATIC,MA,HOUSE DISTRICT THIRD SUFFOLK,Incumbent,Won-General,153557.00
"ROSENBERG, STANLEY C",DEMOCRATIC,MA,"SENATE DISTRICT HAMPSHIRE, FRANKLIN AND WORCESTER",Incumbent,Won-General,147856.76
"COLLINS SR, NICHOLAS PATRICK",DEMOCRATIC,MA,HOUSE DISTRICT FOURTH SUFFOLK,Incumbent,Won-General,147450.65
"MORAN, MICHAEL J",DEMOCRATIC,MA,HOUSE DISTRICT EIGHTEENTH SUFFOLK,Incumbent,Won-General,143349.84
"PACHECO, MARC RICHARD",DEMOCRATIC,MA,SENATE DISTRICT FIRST PLYMOUTH AND BRISTOL,Incumbent,Won-General,140990.00
"MURPHY, CHARLES A",DEMOCRATIC,MA,HOUSE DISTRICT TWENTY-FIRST MIDDLESEX,Incumbent,Withdrew-General,138222.56
"CHANG-DIAZ, SONIA",DEMOCRATIC,MA,SENATE DISTRICT SECOND SUFFOLK,Incumbent,Won-General,136382.16
"BREWER, STEPHEN M",DEMOCRATIC,MA,"SENATE DISTRICT WORCESTER, HAMPDEN, HAMPSHIRE AND MIDDLESEX",Incumbent,Won-General,136081.04
"CLARK, KATHERINE M",DEMOCRATIC,MA,SENATE DISTRICT FIFTH MIDDLESEX,Incumbent,Won-General,135196.85
"FORRY, LINDA DORCENA",DEMOCRATIC,MA,HOUSE DISTRICT TWELFTH SUFFOLK,Incumbent,Won-General,133720.50
"JONES JR, BRADLEY H",REPUBLICAN,MA,HOUSE DISTRICT TWENTIETH MIDDLESEX,Incumbent,Won-General,131156.63
"ADAMS, PAUL",REPUBLICAN,MA,SENATE DISTRICT SECOND ESSEX AND MIDDLESEX,Challenger,Lost-General,130107.88
"TARR, BRUCE",REPUBLICAN,MA,SENATE DISTRICT FIRST ESSEX AND MIDDLESEX,Incumbent,Won-General,129495.35
"CUTLER, JOSH S",DEMOCRATIC,MA,HOUSE DISTRICT SIXTH PLYMOUTH,Open,Won-General,129469.97
"DONATO, PAUL J",DEMOCRATIC,MA,HOUSE DISTRICT THIRTY-FIFTH MIDDLESEX,Incumbent,Won-General,128708.44
"CANTWELL, JAMES M",DEMOCRATIC,MA,HOUSE DISTRICT FOURTH PLYMOUTH,Incumbent,Won-General,128025.49
"FATTMAN, RYAN C",REPUBLICAN,MA,HOUSE DISTRICT EIGHTEENTH WORCESTER,Incumbent,Won-General,122707.96
"CANDARAS, GALE D",DEMOCRATIC,MA,SENATE DISTRICT FIRST HAMPDEN AND HAMPSHIRE,Incumbent,Won-General,121927.22
"WINSLOW, DANIEL B",REPUBLICAN,MA,HOUSE DISTRICT NINTH NORFOLK,Incumbent,Won-General,121864.92
"TIMILTY, JAMES E",DEMOCRATIC,MA,SENATE DISTRICT BRISTOL AND NORFOLK,Incumbent,Won-General,121514.73
"ELLIS, R PATRICK",DEMOCRATIC,MA,HOUSE DISTRICT FIFTH BARNSTABLE,Challenger,Lost-General,120194.68
"CALTER III, THOMAS J",DEMOCRATIC,MA,HOUSE DISTRICT TWELFTH PLYMOUTH,Incumbent,Won-General,118798.24
"CHANDLER, HARRIETTE L",DEMOCRATIC,MA,SENATE DISTRICT FIRST WORCESTER,Incumbent,Won-General,114622.60
"TIMILTY, WALTER F",DEMOCRATIC,MA,HOUSE DISTRICT SEVENTH NORFOLK,Incumbent,Won-General,112431.70
"KNAPIK, MICHAEL",REPUBLICAN,MA,SENATE DISTRICT SECOND HAMPDEN AND HAMPSHIRE,Incumbent,Won-General,111827.21
"RUSH, MICHAEL F",DEMOCRATIC,MA,SENATE DISTRICT NORFOLK & SUFFOLK,Incumbent,Won-General,110549.26
"NANGLE, DAVID",DEMOCRATIC,MA,HOUSE DISTRICT SEVENTEENTH MIDDLESEX,Incumbent,Won-General,109690.37
"DONNELLY, KENNETH J",DEMOCRATIC,MA,SENATE DISTRICT FOURTH MIDDLESEX,Incumbent,Won-General,108927.45
"DONOGHUE, EILEEN M",DEMOCRATIC,MA,SENATE DISTRICT FIRST MIDDLESEX,Incumbent,Won-General,107971.32
"BRADLEY, GARRETT JAMES",DEMOCRATIC,MA,HOUSE DISTRICT THIRD PLYMOUTH,Incumbent,Won-General,107524.00
"SPILKA, KAREN E",DEMOCRATIC,MA,SENATE DISTRICT SECOND MIDDLESEX AND NORFOLK,Incumbent,Won-General,107036.12
"PUPPOLO JR, ANGELO J",DEMOCRATIC,MA,HOUSE DISTRICT TWELFTH HAMPDEN,Incumbent,Won-General,106144.56
"REINSTEIN, KATHI-ANNE",DEMOCRATIC,MA,HOUSE DISTRICT SIXTEENTH SUFFOLK,Incumbent,Won-General,106095.25
"WELCH, JAMES T",DEMOCRATIC,MA,SENATE DISTRICT HAMPDEN,Incumbent,Won-General,104869.74
"LYONS JR, JAMES J",REPUBLICAN,MA,HOUSE DISTRICT EIGHTEENTH ESSEX,Incumbent,Won-General,101209.20
"BROWNSBERGER, WILLIAM N",DEMOCRATIC,MA,SENATE DISTRICT SECOND SUFFOLK AND MIDDLESEX,Open,Won-General,96790.00
"DECKER, MARJORIE C",DEMOCRATIC,MA,HOUSE DISTRICT TWENTY-FIFTH MIDDLESEX,Open,Won-General,95859.25
"CRONIN, CLAIRE D",DEMOCRATIC,MA,HOUSE DISTRICT ELEVENTH PLYMOUTH,Open,Won-General,95086.43
"LITALIEN, BARBARA",DEMOCRATIC,MA,HOUSE DISTRICT EIGHTEENTH ESSEX,Challenger,Lost-General,94543.61
"WALSH, STEVEN M",DEMOCRATIC,MA,HOUSE DISTRICT ELEVENTH ESSEX,Incumbent,Won-General,93283.24
"STRAUS, WILLIAM M",DEMOCRATIC,MA,HOUSE DISTRICT TENTH BRISTOL,Incumbent,Won-General,93190.24
"FLANAGAN, JENNIFER L",DEMOCRATIC,MA,SENATE DISTRICT WORCESTER AND MIDDLESEX,Incumbent,Won-General,92566.67
"KENNEDY, THOMAS P",DEMOCRATIC,MA,SENATE DISTRICT SECOND PLYMOUTH AND BRISTOL,Incumbent,Won-General,92083.39
"BASILE, CARLO",DEMOCRATIC,MA,HOUSE DISTRICT FIRST SUFFOLK,Incumbent,Won-General,91855.62
"ODAY, JAMES J",DEMOCRATIC,MA,HOUSE DISTRICT FOURTEENTH WORCESTER,Incumbent,Won-General,91571.30
"MIRRA, LEONARD",REPUBLICAN,MA,HOUSE DISTRICT SECOND ESSEX,Open,Won-General,90872.10
"PETROLATI, THOMAS M",DEMOCRATIC,MA,HOUSE DISTRICT SEVENTH HAMPDEN,Incumbent,Won-General,88760.05
"BINIENDA SR, JOHN J",DEMOCRATIC,MA,HOUSE DISTRICT SEVENTEENTH WORCESTER,Incumbent,Won-General,88055.24
"OCONNELL, SHAUNNA L",REPUBLICAN,MA,HOUSE DISTRICT THIRD BRISTOL,Incumbent,Won-General,85258.05
"MARTINEZ, SANDRA B",REPUBLICAN,MA,SENATE DISTRICT THIRD MIDDLESEX,Open,Lost-General,85215.30
"TOOHEY, SHAUN",REPUBLICAN,MA,SENATE DISTRICT FIRST ESSEX,Open,Lost-General,85195.00
"BARRY, KAREN",REPUBLICAN,MA,HOUSE DISTRICT SIXTH PLYMOUTH,Open,Lost-General,83569.57
"SCHMID III, PAUL A",DEMOCRATIC,MA,HOUSE DISTRICT EIGHTH BRISTOL,Incumbent,Won-General,83343.24
"KENNEDY, TERRENCE W",DEMOCRATIC,MA,EXECUTIVE COUNCILOR DISTRICT 006,Incumbent,Won-General,83100.00
"ROGERS, DAVID M",DEMOCRATIC,MA,HOUSE DISTRICT TWENTY-FOURTH MIDDLESEX,Open,Won-General,82672.34
"NAUGHTON JR, HAROLD P",DEMOCRATIC,MA,HOUSE DISTRICT TWELFTH WORCESTER,Incumbent,Won-General,82276.62
"HADDAD, PATRICIA A",DEMOCRATIC,MA,HOUSE DISTRICT FIFTH BRISTOL,Incumbent,Won-General,81429.77
"BROWNSBERGER, WILLIAM N",DEMOCRATIC,MA,SENATE DISTRICT SECOND SUFFOLK AND MIDDLESEX,Incumbent,Won-General,80346.26
"OFLAHERTY, EUGENE L",DEMOCRATIC,MA,HOUSE DISTRICT SECOND SUFFOLK,Incumbent,Won-General,79792.00
"SMITH, STEPHEN STAT",DEMOCRATIC,MA,HOUSE DISTRICT TWENTY-EIGHTH MIDDLESEX,Incumbent,Won-General,79644.80
"LEWIS, JASON M",DEMOCRATIC,MA,HOUSE DISTRICT THIRTY-FIRST MIDDLESEX,Incumbent,Won-General,79589.99
"IVES, KATHLEEN A OCONNOR",DEMOCRATIC,MA,SENATE DISTRICT FIRST ESSEX,Open,Won-General,79531.21
"ROGERS, JOHN H",DEMOCRATIC,MA,HOUSE DISTRICT TWELFTH NORFOLK,Incumbent,Won-General,78859.98
"ROY, JEFFREY N",DEMOCRATIC,MA,HOUSE DISTRICT TENTH NORFOLK,Open,Won-General,78391.45
"SHELDON, CHRISTOPHER",REPUBLICAN,MA,US HOUSE DISTRICT MA 009,Challenger,Lost-General,77884.46
"HONAN, KEVIN G",DEMOCRATIC,MA,HOUSE DISTRICT SEVENTEENTH SUFFOLK,Incumbent,Won-General,73833.24
"HEDLUND, ROBERT L",REPUBLICAN,MA,SENATE DISTRICT PLYMOUTH AND NORFOLK,Incumbent,Won-General,73323.52
"MCGEE, THOMAS M",DEMOCRATIC,MA,SENATE DISTRICT THIRD ESSEX,Incumbent,Won-General,72007.01
"WAGNER, JOSEPH F",DEMOCRATIC,MA,HOUSE DISTRICT EIGHTH HAMPDEN,Incumbent,Won-General,71746.11
"PETERSON JR, GEORGE",REPUBLICAN,MA,HOUSE DISTRICT NINTH WORCESTER,Incumbent,Won-General,70846.91
"SPELIOTIS, THEODORE C",DEMOCRATIC,MA,HOUSE DISTRICT THIRTEENTH ESSEX,Incumbent,Won-General,70564.56
"DWYER, JAMES J",DEMOCRATIC,MA,HOUSE DISTRICT THIRTIETH MIDDLESEX,Incumbent,Won-General,70345.56
"SANNICANDRO, TOM",DEMOCRATIC,MA,HOUSE DISTRICT SEVENTH MIDDLESEX,Incumbent,Won-General,69131.06
"SANCHEZ, JEFFREY",DEMOCRATIC,MA,HOUSE DISTRICT FIFTEENTH SUFFOLK,Open,Won-General,66955.00
"DEMILIA, ANGELO L",REPUBLICAN,MA,HOUSE DISTRICT EIGHTH PLYMOUTH,Incumbent,Won-General,66122.18
"HUNT, RANDY",REPUBLICAN,MA,HOUSE DISTRICT FIFTH BARNSTABLE,Incumbent,Won-General,64935.89
"PIGNATELLI, WILLIAM (SMITTY)",DEMOCRATIC,MA,HOUSE DISTRICT FOURTH BERKSHIRE,Incumbent,Won-General,64025.00
"FOGEL, BARRY P",DEMOCRATIC,MA,HOUSE DISTRICT SECOND ESSEX,Open,Lost-General,63965.87
"CHAN, TACKEY",DEMOCRATIC,MA,HOUSE DISTRICT SECOND NORFOLK,Incumbent,Won-General,63094.00
"FERRANTE, ANN-MARGARET",DEMOCRATIC,MA,HOUSE DISTRICT FIFTH ESSEX,Incumbent,Won-General,63025.00
"NYMAN, RHONDA L",DEMOCRATIC,MA,HOUSE DISTRICT FIFTH PLYMOUTH,Incumbent,Won-General,62004.03
"DIEHL, GEOFF",REPUBLICAN,MA,HOUSE DISTRICT SEVENTH PLYMOUTH,Incumbent,Won-General,61977.24
"FRESOLO, JOHN P",DEMOCRATIC,MA,HOUSE DISTRICT SIXTEENTH WORCESTER,Incumbent,Won-General,61568.10
"LAWN JR, JOHN J",DEMOCRATIC,MA,HOUSE DISTRICT TENTH MIDDLESEX,Incumbent,Won-General,61338.37
"DYKEMA, CAROLYN C",DEMOCRATIC,MA,HOUSE DISTRICT EIGHTH MIDDLESEX,Incumbent,Won-General,60261.39
"STANLEY, THOMAS M",DEMOCRATIC,MA,HOUSE DISTRICT NINTH MIDDLESEX,Incumbent,Won-General,60166.24
"KUROS, KEVIN J",REPUBLICAN,MA,HOUSE DISTRICT EIGHTH WORCESTER,Incumbent,Won-General,59991.54
"COPPINGER, EDWARD F",DEMOCRATIC,MA,HOUSE DISTRICT TENTH SUFFOLK,Incumbent,Won-General,59923.23
"ATKINS, CORY",DEMOCRATIC,MA,HOUSE DISTRICT FOURTEENTH MIDDLESEX,Incumbent,Won-General,59510.28
"SILVIA, ALAN D",DEMOCRATIC,MA,HOUSE DISTRICT SEVENTH BRISTOL,Open,Won-General,59360.44
"TOOMEY JR, TIMOTHY J",DEMOCRATIC,MA,HOUSE DISTRICT TWENTY-SIXTH MIDDLESEX,Incumbent,Won-General,59264.26
"WELCH, KOREY M",REPUBLICAN,MA,HOUSE DISTRICT FIFTH PLYMOUTH,Challenger,Lost-General,58089.66
"LEVY, STEVEN L",REPUBLICAN,MA,HOUSE DISTRICT FOURTH MIDDLESEX,Incumbent,Lost-General,57712.83
"GOLDEN JR, THOMAS A",DEMOCRATIC,MA,HOUSE DISTRICT SIXTEENTH MIDDLESEX,Incumbent,Won-General,57619.42
"MAHONEY, JOHN J",DEMOCRATIC,MA,HOUSE DISTRICT THIRTEENTH WORCESTER,Incumbent,Won-General,57475.00
"LEE, SUSANNAH M",REPUBLICAN,MA,HOUSE DISTRICT SECOND FRANKLIN,Challenger,Lost-General,57125.97
"LAMB, MARTIN A",REPUBLICAN,MA,HOUSE DISTRICT EIGHTH MIDDLESEX,Challenger,Lost-General,57101.53
"MCMURTRY, PAUL",DEMOCRATIC,MA,HOUSE DISTRICT ELEVENTH NORFOLK,Incumbent,Won-General,57084.44
"WEBSTER, DANIEL K",REPUBLICAN,MA,HOUSE DISTRICT SIXTH PLYMOUTH,Incumbent,Withdrew-General,56587.24
"STANTON, JAMES M",REPUBLICAN,MA,HOUSE DISTRICT TWELFTH NORFOLK,Challenger,Lost-General,56038.00
"FENNELL, ROBERT F",DEMOCRATIC,MA,HOUSE DISTRICT TENTH ESSEX,Incumbent,Won-General,55608.12
"VEGA, AARON",DEMOCRATIC,MA,HOUSE DISTRICT FIFTH HAMPDEN,Open,Won-General,55513.74
"EUSTIS, RICHARD A",REPUBLICAN,MA,HOUSE DISTRICT TENTH NORFOLK,Open,Lost-General,55167.52
"WALZ, MARTHA MARTY",DEMOCRATIC,MA,HOUSE DISTRICT EIGHTH SUFFOLK,Incumbent,Won-General,55035.52
"KHAN, KAY",DEMOCRATIC,MA,HOUSE DISTRICT ELEVENTH MIDDLESEX,Incumbent,Won-General,53655.92
"SCIBAK, JOHN W",DEMOCRATIC,MA,HOUSE DISTRICT SECOND HAMPSHIRE,Incumbent,Won-General,53346.18
"BALSER, RUTH B",DEMOCRATIC,MA,HOUSE DISTRICT TWELFTH MIDDLESEX,Incumbent,Won-General,52909.31
"MARKEY, CHRISTOPHER M",DEMOCRATIC,MA,HOUSE DISTRICT NINTH BRISTOL,Incumbent,Won-General,52898.24
"FINN, MICHAEL J",DEMOCRATIC,MA,HOUSE DISTRICT SIXTH HAMPDEN,Incumbent,Won-General,52698.23
"HOWITT, STEVEN S",REPUBLICAN,MA,HOUSE DISTRICT FOURTH BRISTOL,Incumbent,Won-General,51873.76
"PEAKE, SARAH K",DEMOCRATIC,MA,HOUSE DISTRICT FOURTH BARNSTABLE,Incumbent,Won-General,50895.50
"FALLON, CHRISTOPHER G",DEMOCRATIC,MA,HOUSE DISTRICT THIRTY-THIRD MIDDLESEX,Incumbent,Won-General,50534.50
"CUSACK, MARK JAMES",DEMOCRATIC,MA,HOUSE DISTRICT FIFTH NORFOLK,Incumbent,Won-General,48461.31
"MARK, PAUL W",DEMOCRATIC,MA,HOUSE DISTRICT SECOND BERKSHIRE,Incumbent,Won-General,48280.68
"KEEFE, MARY S",DEMOCRATIC,MA,HOUSE DISTRICT FIFTEENTH WORCESTER,Open,Won-General,47923.17
"KAFKA, LOUIS L",DEMOCRATIC,MA,HOUSE DISTRICT EIGHTH NORFOLK,Incumbent,Won-General,47364.24
"ALBANO, MICHAEL J",DEMOCRATIC,MA,EXECUTIVE COUNCILOR DISTRICT 008,Open,Won-General,47265.00
"GARLICK, DENISE C",DEMOCRATIC,MA,HOUSE DISTRICT THIRTEENTH NORFOLK,Incumbent,Won-General,46547.97
"GAMMILL, JAMES F",OTHER,MA,HOUSE DISTRICT TWENTY-FOURTH MIDDLESEX,Open,Lost-General,45951.83
"LOMBARDO, MARC T",REPUBLICAN,MA,HOUSE DISTRICT TWENTY-SECOND MIDDLESEX,Incumbent,Won-General,45731.00
"ARCIERO, JAMES",DEMOCRATIC,MA,HOUSE DISTRICT SECOND MIDDLESEX,Incumbent,Won-General,45720.00
"KULIK, STEPHEN",DEMOCRATIC,MA,HOUSE DISTRICT FIRST FRANKLIN,Incumbent,Won-General,45654.30
"BOLDYGA, NICHOLAS (NICK)",REPUBLICAN,MA,HOUSE DISTRICT THIRD HAMPDEN,Incumbent,Won-General,45068.37
"SULLIVAN, DAVID B",DEMOCRATIC,MA,HOUSE DISTRICT SIXTH BRISTOL,Incumbent,Won-General,44833.87
"HUNT, MARILEE KENNEY",DEMOCRATIC,MA,HOUSE DISTRICT EIGHTH PLYMOUTH,Challenger,Lost-General,44682.02
"ANDREWS, DENISE",DEMOCRATIC,MA,HOUSE DISTRICT SECOND FRANKLIN,Incumbent,Won-General,44214.46
"DIZOGLIO, DIANA",DEMOCRATIC,MA,HOUSE DISTRICT FOURTEENTH ESSEX,Open,Won-General,43228.26
"ROSS, RICHARD",REPUBLICAN,MA,"SENATE DISTRICT NORFOLK, BRISTOL AND MIDDLESEX",Incumbent,Won-General,43018.00
"BRUNELLE JR, ROGER P",DEMOCRATIC,MA,HOUSE DISTRICT TWELFTH BRISTOL,Challenger,Lost-General,42335.00
"BEATON, MATTHEW A",REPUBLICAN,MA,HOUSE DISTRICT ELEVENTH WORCESTER,Incumbent,Won-General,42170.45
"MURPHY, JAMES",DEMOCRATIC,MA,HOUSE DISTRICT FOURTH NORFOLK,Incumbent,Won-General,41901.00
"KEENAN, JOHN F",DEMOCRATIC,MA,SENATE DISTRICT NORFOLK AND PLYMOUTH,Incumbent,Won-General,41198.84
"HOGAN, KATE",DEMOCRATIC,MA,HOUSE DISTRICT THIRD MIDDLESEX,Incumbent,Won-General,40693.94
"DUFF, EILEEN R",DEMOCRATIC,MA,EXECUTIVE COUNCILOR DISTRICT 005,Open,Won-General,40393.00
"WALSH, CHRIS",DEMOCRATIC,MA,HOUSE DISTRICT SIXTH MIDDLESEX,Incumbent,Won-General,39495.47
"BASTIEN, RICH",REPUBLICAN,MA,HOUSE DISTRICT SECOND WORCESTER,Incumbent,Lost-General,38553.20
"BETZ, DEBRA A",REPUBLICAN,MA,HOUSE DISTRICT TWELFTH PLYMOUTH,Challenger,Lost-General,38506.11
"LINSKY, DAVID PAUL",DEMOCRATIC,MA,HOUSE DISTRICT FIFTH MIDDLESEX,Incumbent,Won-General,38384.11
"SCIORTINO JR, CARL M",DEMOCRATIC,MA,HOUSE DISTRICT THIRTY-FOURTH MIDDLESEX,Incumbent,Won-General,37911.36
"SCACCIA, ANGELO M",DEMOCRATIC,MA,HOUSE DISTRICT FOURTEENTH SUFFOLK,Incumbent,Won-General,37782.75
"HILL, BRADFORD R",REPUBLICAN,MA,HOUSE DISTRICT FOURTH ESSEX,Incumbent,Won-General,37770.00
"FETHERSTON, JON ANDREW",REPUBLICAN,MA,HOUSE DISTRICT SEVENTH MIDDLESEX,Challenger,Lost-General,37341.12
"DUBOIS, ROBERT J",DEMOCRATIC,MA,HOUSE DISTRICT EIGHTH WORCESTER,Challenger,Lost-General,37143.00
"CAVARETTA, DEAN J",REPUBLICAN,MA,SENATE DISTRICT MIDDLESEX AND WORCESTER,Challenger,Lost-General,36628.13
"ORRALL, KEIKO M",REPUBLICAN,MA,HOUSE DISTRICT TWELFTH BRISTOL,Incumbent,Won-General,36426.82
"DURANT, PETER J",REPUBLICAN,MA,HOUSE DISTRICT SIXTH WORCESTER,Incumbent,Won-General,36043.93
"MAGLIOCCHETTI, PAUL",INDEPENDENT,MA,SENATE DISTRICT FIRST ESSEX,Open,Lost-General,35838.01
"HUMASON JR, DONALD F",REPUBLICAN,MA,HOUSE DISTRICT FOURTH HAMPDEN,Incumbent,Won-General,35687.00
"ROSS, GEORGE T",REPUBLICAN,MA,HOUSE DISTRICT SECOND BRISTOL,Incumbent,Lost-General,35510.02
"KOCOT, PETER V",DEMOCRATIC,MA,HOUSE DISTRICT FIRST HAMPSHIRE,Incumbent,Won-General,35241.93
"BRODEUR, PAUL",DEMOCRATIC,MA,HOUSE DISTRICT THIRTY-SECOND MIDDLESEX,Incumbent,Won-General,34791.21
"OLSON, TOMMASINA ANNE",REPUBLICAN,MA,HOUSE DISTRICT TWENTY-FOURTH MIDDLESEX,Open,Lost-General,34770.40
"ZLOTNIK, JONATHAN D",DEMOCRATIC,MA,HOUSE DISTRICT SECOND WORCESTER,Challenger,Won-General,34463.68
"JEHLEN, PATRICIA D",DEMOCRATIC,MA,SENATE DISTRICT SECOND MIDDLESEX,Incumbent,Won-General,34426.81
"MICELI, JAMES R",DEMOCRATIC,MA,HOUSE DISTRICT NINETEENTH MIDDLESEX,Incumbent,Won-General,34146.24
"PROVOST, DENISE",DEMOCRATIC,MA,HOUSE DISTRICT TWENTY-SEVENTH MIDDLESEX,Incumbent,Won-General,33947.49
"DINATALE, STEPHEN L",DEMOCRATIC,MA,HOUSE DISTRICT THIRD WORCESTER,Incumbent,Won-General,33879.49
"MONTIGNY, MARK",DEMOCRATIC,MA,SENATE DISTRICT SECOND BRISTOL AND PLYMOUTH,Incumbent,Won-General,33723.25
"SMOLA, TODD M",REPUBLICAN,MA,HOUSE DISTRICT FIRST HAMPDEN,Incumbent,Won-General,33652.00
"ANGELIDES, MARIE",REPUBLICAN,MA,HOUSE DISTRICT SECOND HAMPDEN,Challenger,Lost-General,33281.37
"CALLAHAN, WILLIAM",REPUBLICAN,MA,HOUSE DISTRICT FIFTH MIDDLESEX,Challenger,Lost-General,32790.00
"ROSA, DENNIS A",DEMOCRATIC,MA,HOUSE DISTRICT FOURTH WORCESTER,Incumbent,Won-General,32604.48
"CAMPBELL, LINDA DEAN",DEMOCRATIC,MA,HOUSE DISTRICT FIFTEENTH ESSEX,Incumbent,Won-General,32021.24
"COAKLEY-RIVERA, CHERYL",DEMOCRATIC,MA,HOUSE DISTRICT TENTH HAMPDEN,Incumbent,Won-General,31828.12
"WONG, DONALD H",REPUBLICAN,MA,HOUSE DISTRICT NINTH ESSEX,Incumbent,Won-General,31588.30
"HEROUX, PAUL R",DEMOCRATIC,MA,HOUSE DISTRICT SECOND BRISTOL,Challenger,Won-General,31538.83
"KAUFMAN, JAY R",DEMOCRATIC,MA,HOUSE DISTRICT FIFTEENTH MIDDLESEX,Incumbent,Won-General,30449.50
"BARROWS, FRED (JAY)",REPUBLICAN,MA,HOUSE DISTRICT FIRST BRISTOL,Incumbent,Won-General,30325.00
"COSTA-HANLON, SHERRY",DEMOCRATIC,MA,HOUSE DISTRICT THIRD BRISTOL,Challenger,Lost-General,29888.84
"MURPHY, DANIEL J",REPUBLICAN,MA,HOUSE DISTRICT ELEVENTH PLYMOUTH,Open,Lost-General,29690.00
"HECHT, JONATHAN",DEMOCRATIC,MA,HOUSE DISTRICT TWENTY-NINTH MIDDLESEX,Open,Won-General,29359.55
"BROOKS, JUSTIN A",REPUBLICAN,MA,HOUSE DISTRICT FOURTH WORCESTER,Challenger,Lost-General,29114.50
"DEMACEDO, VIRIATO MANUEL (VINNY)",REPUBLICAN,MA,HOUSE DISTRICT FIRST PLYMOUTH,Incumbent,Won-General,28605.00
"WALKER, KATHLEEN",DEMOCRATIC,MA,HOUSE DISTRICT SIXTH WORCESTER,Challenger,Lost-General,28483.47
"RHOTON, KARIN K",REPUBLICAN,MA,HOUSE DISTRICT FOURTEENTH ESSEX,Open,Lost-General,27905.00
"DEVANEY, MARILYN PETITTO",DEMOCRATIC,MA,EXECUTIVE COUNCILOR DISTRICT 003,Incumbent,Won-General,27838.00
"PEISCH, ALICE HANLON",DEMOCRATIC,MA,HOUSE DISTRICT FOURTEENTH NORFOLK,Incumbent,Won-General,27604.00
"IANNELLA JR, CHRISTOPHER",DEMOCRATIC,MA,EXECUTIVE COUNCILOR DISTRICT 004,Incumbent,Won-General,26649.00
"PARISELLA, JERALD A",DEMOCRATIC,MA,HOUSE DISTRICT SIXTH ESSEX,Incumbent,Won-General,26633.24
"HARRINGTON, SHEILA C",REPUBLICAN,MA,HOUSE DISTRICT FIRST MIDDLESEX,Incumbent,Won-General,26632.81
"CAISSIE, JENNIE L",REPUBLICAN,MA,EXECUTIVE COUNCILOR DISTRICT 007,Incumbent,Won-General,26576.80
"GORDON, KENNETH",DEMOCRATIC,MA,HOUSE DISTRICT TWENTY-FIRST MIDDLESEX,Open,Won-General,26102.81
"MURPHY, KEVIN J",DEMOCRATIC,MA,HOUSE DISTRICT EIGHTEENTH MIDDLESEX,Incumbent,Won-General,26053.24
"POIRIER, ELIZABETH A",REPUBLICAN,MA,HOUSE DISTRICT FOURTEENTH BRISTOL,Incumbent,Won-General,26011.05
"STORY, ELLEN",DEMOCRATIC,MA,HOUSE DISTRICT THIRD HAMPSHIRE,Incumbent,Won-General,25655.72
"DISANTI JR, SAMUEL SALVATORE",DEMOCRATIC,MA,HOUSE DISTRICT THIRD HAMPDEN,Challenger,Lost-General,25321.78
"FOX, GLORIA",DEMOCRATIC,MA,HOUSE DISTRICT SEVENTH SUFFOLK,Incumbent,Won-General,25213.33
"MALIA, ELIZABETH A",DEMOCRATIC,MA,HOUSE DISTRICT ELEVENTH SUFFOLK,Incumbent,Won-General,24670.05
"GREGOIRE, DANIELLE W",DEMOCRATIC,MA,HOUSE DISTRICT FOURTH MIDDLESEX,Challenger,Won-General,24628.04
"GALVIN, WILLIAM C",DEMOCRATIC,MA,HOUSE DISTRICT SIXTH NORFOLK,Incumbent,Won-General,24493.24
"GEORGOUNTZOS, GEORGE",REPUBLICAN,MA,HOUSE DISTRICT THIRTY-FIRST MIDDLESEX,Challenger,Lost-General,24439.15
"GARRY, COLLEEN",DEMOCRATIC,MA,HOUSE DISTRICT THIRTY-SIXTH MIDDLESEX,Incumbent,Won-General,24290.00
"COULTER, STEPHEN W",REPUBLICAN,MA,HOUSE DISTRICT FOURTH PLYMOUTH,Challenger,Lost-General,24170.52
"CABRAL, ANTONIO F D",DEMOCRATIC,MA,HOUSE DISTRICT THIRTEENTH BRISTOL,Incumbent,Won-General,23148.19
"MCCARTHY, WILLIAM J",REPUBLICAN,MA,HOUSE DISTRICT FOURTEENTH WORCESTER,Challenger,Lost-General,23102.58
"ASHE, BRIAN MICHAEL",DEMOCRATIC,MA,HOUSE DISTRICT SECOND HAMPDEN,Incumbent,Won-General,23077.24
"SELVAGGI, JOE",REPUBLICAN,MA,US HOUSE DISTRICT MA 008,Challenger,Lost-General,22914.89
"DEVERS, MARCOS A",DEMOCRATIC,MA,HOUSE DISTRICT SIXTEENTH ESSEX,Incumbent,Won-General,22709.87
"FROST, PAUL K",REPUBLICAN,MA,HOUSE DISTRICT SEVENTH WORCESTER,Incumbent,Won-General,22534.20
"GIFFORD, SUSAN",REPUBLICAN,MA,HOUSE DISTRICT SECOND PLYMOUTH,Incumbent,Won-General,22491.00
"CREEM, CYNTHIA STONE",DEMOCRATIC,MA,SENATE DISTRICT FIRST MIDDLESEX AND NORFOLK,Incumbent,Won-General,22332.71
"BRADY, MICHAEL D",DEMOCRATIC,MA,HOUSE DISTRICT NINTH PLYMOUTH,Incumbent,Won-General,22272.71
"SEARS, DOUGLAS W",REPUBLICAN,MA,HOUSE DISTRICT NINETEENTH MIDDLESEX,Challenger,Lost-General,22167.00
"RICHARDSON, CATHY",REPUBLICAN,MA,HOUSE DISTRICT THIRTY-SIXTH MIDDLESEX,Challenger,Lost-General,22005.34
"SWISTON, GREER TAN",REPUBLICAN,MA,HOUSE DISTRICT ELEVENTH MIDDLESEX,Challenger,Lost-General,21302.35
"VIEIRA, DAVID T",REPUBLICAN,MA,HOUSE DISTRICT THIRD BARNSTABLE,Incumbent,Won-General,19767.90
"EHRLICH, LORI A",DEMOCRATIC,MA,HOUSE DISTRICT EIGHTH ESSEX,Incumbent,Won-General,19734.24
"WORMELL, VALERIE A",REPUBLICAN,MA,HOUSE DISTRICT SECOND MIDDLESEX,Challenger,Lost-General,19278.00
"BOURQUE, DONALD D",DEMOCRATIC,MA,HOUSE DISTRICT EIGHTEENTH WORCESTER,Challenger,Lost-General,19251.23
"AYERS, BRUCE J",DEMOCRATIC,MA,HOUSE DISTRICT FIRST NORFOLK,Incumbent,Won-General,18715.00
"CARREIRO, A KEITH",DEMOCRATIC,MA,HOUSE DISTRICT FOURTH BRISTOL,Challenger,Lost-General,18240.75
"BAILEY, JEFFREY ROBERT",REPUBLICAN,MA,SENATE DISTRICT BRISTOL AND NORFOLK,Challenger,Lost-General,17838.79
"MORAN, FRANK A",DEMOCRATIC,MA,HOUSE DISTRICT SEVENTEENTH ESSEX,Open,Won-General,17485.78
"GARBALLEY, SEAN",DEMOCRATIC,MA,HOUSE DISTRICT TWENTY-THIRD MIDDLESEX,Incumbent,Won-General,17458.36
"CIPOLLINI JR, OLIVER P",DEMOCRATIC,MA,EXECUTIVE COUNCILOR DISTRICT 001,Challenger,Won-General,17360.02
"DEMBROWSKI, GERRY",REPUBLICAN,MA,SENATE DISTRICT FOURTH MIDDLESEX,Challenger,Lost-General,17350.27
"TOOMEY JR, ROBERT L",DEMOCRATIC,MA,HOUSE DISTRICT SEVENTH PLYMOUTH,Challenger,Lost-General,16960.00
"MONJU, JOSEPH J",REPUBLICAN,MA,HOUSE DISTRICT TWENTY-THIRD MIDDLESEX,Challenger,Lost-General,16506.55
"HOLMES, RUSSELL E",DEMOCRATIC,MA,HOUSE DISTRICT SIXTH SUFFOLK,Incumbent,Won-General,15900.63
"KOCZERA, ROBERT M",DEMOCRATIC,MA,HOUSE DISTRICT ELEVENTH BRISTOL,Incumbent,Won-General,15693.37
"KELCOURSE, JAMES",UNENROLLED,MA,SENATE DISTRICT FIRST ESSEX,Open,Lost-General,15631.96
"SWAN, BENJAMIN",DEMOCRATIC,MA,HOUSE DISTRICT ELEVENTH HAMPDEN,Incumbent,Won-General,15625.50
"CIARDIELLO, MAURA L P",REPUBLICAN,MA,EXECUTIVE COUNCILOR DISTRICT 005,Open,Lost-General,14922.74
"CUFF, KEVIN",UNENROLLED,MA,HOUSE DISTRICT SEVENTEENTH ESSEX,Open,Lost-General,14775.00
"TIERNEY, TOM",REPUBLICAN,MA,US HOUSE DISTRICT MA 005,Challenger,Lost-General,14310.00
"CAUFIELD, DWIGHT J",REPUBLICAN,MA,HOUSE DISTRICT TENTH ESSEX,Challenger,Lost-General,14096.70
