Candidate,Party,State,Office,Incumbency,Result,Total Money
"LINSKY, DAVID PAUL",DEMOCRATIC,MA,HOUSE DISTRICT FIFTH MIDDLESEX,Incumbent,Pending,3100.60
"HOLMES, RUSSELL E",DEMOCRATIC,MA,HOUSE DISTRICT SIXTH SUFFOLK,Incumbent,Pending,2875.00
"TRIBOU, CHRISTOPHER J",DEMOCRATIC,MA,HOUSE DISTRICT TWENTY-SECOND MIDDLESEX,Challenger,Pending,2782.00
"EUBANKS-ARCHBOLD, ELMER",REPUBLICAN,MA,HOUSE DISTRICT THIRD WORCESTER,Challenger,Pending,2690.00
"BURKE, WILLIAM",REPUBLICAN,MA,HOUSE DISTRICT SECOND NORFOLK,Challenger,Pending,2580.25
"DOTSON, TERRY BURKE",DEMOCRATIC,MA,HOUSE DISTRICT SEVENTH WORCESTER,Challenger,Pending,2500.00
"ARENA, JOHN WILLIAM",DEMOCRATIC,MA,HOUSE DISTRICT SECOND FRANKLIN,Open,Pending,2351.00
"JUBINVILLE, ROBERT L",DEMOCRATIC,MA,EXECUTIVE COUNCILOR DISTRICT 002,Incumbent,Pending,2325.00
"BARROWS, FRED (JAY)",REPUBLICAN,MA,HOUSE DISTRICT FIRST BRISTOL,Incumbent,Pending,1790.00
"WILLIAMS, ALEXANDER LEIGHTON",REPUBLICAN,MA,SENATE DISTRICT FIRST ESSEX,Open,Pending,1475.00
"PELTIER, DONALD",REPUBLICAN,MA,HOUSE DISTRICT SECOND HAMPSHIRE,Open,Pending,1000.00
"MALAGUTI, CLAIRE M",REPUBLICAN,MA,HOUSE DISTRICT THIRTIETH MIDDLESEX,Open,Pending,985.00
"KEYES, THOMAS F",REPUBLICAN,MA,EXECUTIVE COUNCILOR DISTRICT 001,Challenger,Pending,700.00
"BRADFORD, FORREST W",DEMOCRATIC,MA,HOUSE DISTRICT THIRD HAMPDEN,Challenger,Pending,450.00
"HECHT, JONATHAN",DEMOCRATIC,MA,HOUSE DISTRICT TWENTY-NINTH MIDDLESEX,Incumbent,Pending,177.45
"COLLINS, NICK",DEMOCRATIC,MA,SENATE DISTRICT FIRST SUFFOLK,Open,Won,0.00
"CRIGHTON, BRENDAN P",DEMOCRATIC,MA,SENATE DISTRICT THIRD ESSEX,Open,Default Winner,0.00
"GONZALEZ, JAY",DEMOCRATIC,MA,GOVERNOR,Open,Won,0.00
"PALFREY, QUENTIN",DEMOCRATIC,MA,LIEUTENANT GOVERNOR,Open,Won,0.00
"HAWKINS, JAMES K",DEMOCRATIC,MA,HOUSE DISTRICT SECOND BRISTOL,Open,Won,0.00
"PRESSLEY, AYANNA S",DEMOCRATIC,MA,US HOUSE DISTRICT MA 007,Open,Pending,0.00
"COMERFORD, JO",DEMOCRATIC,MA,"SENATE DISTRICT HAMPSHIRE, FRANKLIN AND WORCESTER",Open,Pending,0.00
"DEMONG, ALISON M",DEMOCRATIC,MA,HOUSE DISTRICT FIFTH PLYMOUTH,Challenger,Pending,0.00
"ROBINSON, MARIA",DEMOCRATIC WRITEIN,MA,HOUSE DISTRICT SIXTH MIDDLESEX,Open,Pending,0.00
"FACTOR, DANIEL L",GREEN-RAINBOW,MA,HOUSE DISTRICT FOURTEENTH MIDDLESEX,Open,Pending,0.00
"SANCHEZ JR, JUAN G",GREEN-RAINBOW,MA,SECRETARY OF STATE,Challenger,Pending,0.00
"GUERIN, JAMIE M",GREEN-RAINBOW,MA,TREASURER,Challenger,Pending,0.00
"STAMAS, EDWARD J",GREEN-RAINBOW,MA,AUDITOR,Challenger,Pending,0.00
"MONCREAFF, MATTHEW O",GREEN-RAINBOW,MA,HOUSE DISTRICT FIRST WORCESTER,Challenger,Pending,0.00
"KHDEER, YASMINE",GREEN-RAINBOW,MA,HOUSE DISTRICT SECOND WORCESTER,Challenger,Pending,0.00
"FRANCO, MICHAEL",INDEPENDENT,MA,EXECUTIVE COUNCILOR DISTRICT 008,Challenger,Pending,0.00
"MENDEZ, ALEXANDER N",INDEPENDENT,MA,SENATE DISTRICT NORFOLK AND PLYMOUTH,Challenger,Pending,0.00
"GOLDSTEIN-ROSE, SOLOMON",INDEPENDENT,MA,HOUSE DISTRICT THIRD HAMPSHIRE,Open,Pending,0.00
"MULLEN, MICHAEL P",INDEPENDENT,MA,US HOUSE DISTRICT MA 003,Open,Pending,0.00
"CHARBONNEAU, MARY JEAN",INDEPENDENT,MA,US HOUSE DISTRICT MA 003,Open,Pending,0.00
"JANSON, MICHAEL",INDEPENDENT,MA,HOUSE DISTRICT THIRTEENTH BRISTOL,Challenger,Pending,0.00
"GARDNER, JAMES K",INDEPENDENT,MA,HOUSE DISTRICT FIFTH ESSEX,Challenger,Pending,0.00
"COLLER, MICHAEL",INDEPENDENT,MA,HOUSE DISTRICT NINTH ESSEX,Challenger,Pending,0.00
"WHIPPS, SUSANNAH M",INDEPENDENT,MA,HOUSE DISTRICT SECOND FRANKLIN,Open,Pending,0.00
"ARMSTRONG, JOSEPH",INDEPENDENT,MA,HOUSE DISTRICT FOURTH PLYMOUTH,Open,Pending,0.00
"POWELL, NATHANIEL K",INDEPENDENT,MA,HOUSE DISTRICT FOURTH PLYMOUTH,Open,Pending,0.00
"KUMAR, KATEEN R",INDEPENDENT,MA,HOUSE DISTRICT THIRTY-FIRST MIDDLESEX,Challenger,Pending,0.00
"FLANNERY, DONALD J",INDEPENDENT,MA,HOUSE DISTRICT TWELFTH HAMPDEN,Challenger,Pending,0.00
"POLITO, KARYN E",REPUBLICAN,MA,LIEUTENANT GOVERNOR,Incumbent,Won,0.00
"HALL, SCOTT",REPUBLICAN,MA,SENATE DISTRICT SECOND PLYMOUTH AND BRISTOL,Challenger,Pending,0.00
"CRUZ, JOHN F",REPUBLICAN,MA,HOUSE DISTRICT TENTH PLYMOUTH,Challenger,Pending,0.00
"BAKER, CHARLES D",REPUBLICAN,MA,GOVERNOR,Incumbent,Won,0.00
"HUGO, JOHN",REPUBLICAN,MA,US HOUSE DISTRICT MA 005,Challenger,Pending,0.00
"SCHNEIDER, JOSEPH S",REPUBLICAN,MA,US HOUSE DISTRICT MA 006,Challenger,Pending,0.00
"PAGLIA, DONATO H",UNENROLLED,MA,HOUSE DISTRICT SIXTH ESSEX,Challenger,Pending,0.00
"DIXON, VINCENT LAWRENCE",UNENROLLED,MA,EXECUTIVE COUNCILOR DISTRICT 006,Challenger,Pending,0.00
"GONSALVES, ANAND",UNENROLLED,MA,HOUSE DISTRICT FIFTEENTH ESSEX,Challenger,Pending,0.00
"MEUSE, PATRICIA M W",UNENROLLED,MA,HOUSE DISTRICT NINETEENTH MIDDLESEX,Open,Pending,0.00
"MARCINCZYK JR, STANLEY P",UNENROLLED,MA,HOUSE DISTRICT TWELFTH WORCESTER,Challenger,Pending,0.00
"GILL, STEPHEN D",VETERAN,MA,SENATE DISTRICT PLYMOUTH AND NORFOLK,Challenger,Pending,0.00
"GARRISON, ALTHEA",INDEPENDENT PROGRESSIVE,MA,HOUSE DISTRICT FIFTH SUFFOLK,Open,Pending,0.00
"FRIEDRICHS, TERRA",COOPERATIVE GREEN ECONOMY,MA,SENATE DISTRICT MIDDLESEX AND WORCESTER,Challenger,Pending,0.00
"MIXON, MATTHEW MURPHY",SECOND AMERICAN REVOLUTION,MA,HOUSE DISTRICT TWENTY-SECOND MIDDLESEX,Challenger,Pending,0.00
