Candidate,Party,State,Office,Incumbency,Result,Total Money
"BAKER, CHARLES D & POLITO, KARYN E",REPUBLICAN,MA,GOVERNOR / LIEUTENANT GOVERNOR,Incumbent,Pending,30498248.15
"WARREN, ELIZABETH A",DEMOCRATIC,MA,US SENATE DISTRICT MA SW-CLASS I,Incumbent,Pending,29022901.95
"AYYADURAI, SHIVA",INDEPENDENT,MA,US SENATE DISTRICT MA SW-CLASS I,Challenger,Pending,4894853.22
"KENNEDY III, JOSEPH P",DEMOCRATIC,MA,US HOUSE DISTRICT MA 004,Incumbent,Pending,3428887.19
"HEALEY, MAURA T",DEMOCRATIC,MA,ATTORNEY GENERAL,Incumbent,Pending,3339740.85
"NEAL, RICHARD E",DEMOCRATIC,MA,US HOUSE DISTRICT MA 001,Incumbent,Pending,2370002.74
"MOULTON, SETH W",DEMOCRATIC,MA,US HOUSE DISTRICT MA 006,Incumbent,Pending,2124800.25
"GONZALEZ, JAY & PALFREY, QUENTIN",DEMOCRATIC,MA,GOVERNOR / LIEUTENANT GOVERNOR,Challenger,Pending,1696013.38
"GOLDBERG, DEBORAH B",DEMOCRATIC,MA,TREASURER,Incumbent,Pending,1237194.66
"TRAHAN, LORI",DEMOCRATIC,MA,US HOUSE DISTRICT MA 003,Open,Pending,1133835.26
"GALVIN, WILLIAM F",DEMOCRATIC,MA,SECRETARY OF STATE,Incumbent,Pending,1047176.17
"DELEO, ROBERT A",DEMOCRATIC,MA,HOUSE DISTRICT NINETEENTH SUFFOLK,Incumbent,Pending,935618.06
"KEATING, WILLIAM RICHARD",DEMOCRATIC,MA,US HOUSE DISTRICT MA 009,Incumbent,Pending,927796.50
"CLARK, KATHERINE M",DEMOCRATIC,MA,US HOUSE DISTRICT MA 005,Incumbent,Pending,850760.31
"MCGOVERN, JAMES P",DEMOCRATIC,MA,US HOUSE DISTRICT MA 002,Incumbent,Pending,814228.50
"GREEN, RICK",REPUBLICAN,MA,US HOUSE DISTRICT MA 003,Open,Pending,780814.76
"DIEHL, GEOFF",REPUBLICAN,MA,US SENATE DISTRICT MA SW-CLASS I,Challenger,Pending,668537.15
"TEDESCHI, PETER D",REPUBLICAN,MA,US HOUSE DISTRICT MA 009,Challenger,Pending,662103.36
"LYNCH, STEPHEN F",DEMOCRATIC,MA,US HOUSE DISTRICT MA 008,Incumbent,Pending,594812.60
"COLLINS, NICK",DEMOCRATIC,MA,SENATE DISTRICT FIRST SUFFOLK,Incumbent,Pending,406408.38
"FINEGOLD, BARRY R",DEMOCRATIC,MA,SENATE DISTRICT SECOND ESSEX AND MIDDLESEX,Open,Pending,352501.00
"SPILKA, KAREN E",DEMOCRATIC,MA,SENATE DISTRICT SECOND MIDDLESEX AND NORFOLK,Incumbent,Pending,349521.38
"BUMP, SUZANNE M",DEMOCRATIC,MA,AUDITOR,Incumbent,Pending,331868.88
"MICHLEWITZ, AARON",DEMOCRATIC,MA,HOUSE DISTRICT THIRD SUFFOLK,Incumbent,Pending,262167.17
"CYR, JULIAN ANDRE",DEMOCRATIC,MA,SENATE DISTRICT CAPE AND ISLANDS,Incumbent,Pending,257770.60
"LESSER, ERIC PHILIP",DEMOCRATIC,MA,SENATE DISTRICT FIRST HAMPDEN AND HAMPSHIRE,Incumbent,Pending,252670.69
"BONCORE, JOSEPH A",DEMOCRATIC,MA,SENATE DISTRICT FIRST SUFFOLK AND MIDDLESEX,Incumbent,Pending,236892.22
"MARIANO, RONALD",DEMOCRATIC,MA,HOUSE DISTRICT THIRD NORFOLK,Incumbent,Pending,230837.00
"RODRIGUES, MICHAEL J",DEMOCRATIC,MA,SENATE DISTRICT FIRST BRISTOL AND PLYMOUTH,Incumbent,Pending,217164.28
"MADARO, ADRIAN C",DEMOCRATIC,MA,HOUSE DISTRICT FIRST SUFFOLK,Incumbent,Pending,185660.39
"MORAN, MICHAEL J",DEMOCRATIC,MA,HOUSE DISTRICT EIGHTEENTH SUFFOLK,Incumbent,Pending,176391.47
"DIDOMENICO, SALVATORE N",DEMOCRATIC,MA,SENATE DISTRICT MIDDLESEX & SUFFOLK,Incumbent,Pending,168145.85
"BUSSE, MARGARET WOOLLEY",REPUBLICAN,MA,SENATE DISTRICT MIDDLESEX AND WORCESTER,Challenger,Pending,164984.10
"GOLDEN JR, THOMAS A",DEMOCRATIC,MA,HOUSE DISTRICT SIXTEENTH MIDDLESEX,Incumbent,Pending,141220.00
"FATTMAN, RYAN C",REPUBLICAN,MA,SENATE DISTRICT WORCESTER AND NORFOLK,Incumbent,Pending,139764.02
"ELDRIDGE, JAMES B",DEMOCRATIC,MA,SENATE DISTRICT MIDDLESEX AND WORCESTER,Incumbent,Pending,136726.21
"NGUYEN, TRAM T",DEMOCRATIC,MA,HOUSE DISTRICT EIGHTEENTH ESSEX,Challenger,Pending,130015.95
"GARLICK, DENISE C",DEMOCRATIC,MA,HOUSE DISTRICT THIRTEENTH NORFOLK,Incumbent,Pending,129243.13
"WELCH, JAMES T",DEMOCRATIC,MA,SENATE DISTRICT HAMPDEN,Incumbent,Pending,127231.20
"PACHECO, MARC RICHARD",DEMOCRATIC,MA,SENATE DISTRICT FIRST PLYMOUTH AND BRISTOL,Incumbent,Pending,127010.96
"MOORE, MICHAEL O",DEMOCRATIC,MA,SENATE DISTRICT SECOND WORCESTER,Incumbent,Pending,125357.29
"DIZOGLIO, DIANA",DEMOCRATIC,MA,SENATE DISTRICT FIRST ESSEX,Open,Pending,124469.67
"LEWIS, JASON M",DEMOCRATIC,MA,SENATE DISTRICT FIFTH MIDDLESEX,Incumbent,Pending,122790.00
"CHANDLER, HARRIETTE L",DEMOCRATIC,MA,SENATE DISTRICT FIRST WORCESTER,Incumbent,Pending,122504.91
"DONATO, PAUL J",DEMOCRATIC,MA,HOUSE DISTRICT THIRTY-FIFTH MIDDLESEX,Incumbent,Pending,120086.76
"CHAN, TACKEY",DEMOCRATIC,MA,HOUSE DISTRICT SECOND NORFOLK,Incumbent,Pending,118661.00
"ELUGARDO, NIKA",DEMOCRATIC,MA,HOUSE DISTRICT FIFTEENTH SUFFOLK,Open,Pending,115661.00
"WAGNER, JOSEPH F",DEMOCRATIC,MA,HOUSE DISTRICT EIGHTH HAMPDEN,Incumbent,Pending,109934.72
"TARR, BRUCE",REPUBLICAN,MA,SENATE DISTRICT FIRST ESSEX AND MIDDLESEX,Incumbent,Pending,108945.37
"CRIGHTON, BRENDAN P",DEMOCRATIC,MA,SENATE DISTRICT THIRD ESSEX,Incumbent,Pending,102274.61
"HINDS, ADAM G",DEMOCRATIC,MA,"SENATE DISTRICT BERKSHIRE, HAMPSHIRE, FRANKLIN AND HAMPDEN",Incumbent,Pending,100892.59
"TIMILTY, WALTER F",DEMOCRATIC,MA,"SENATE DISTRICT NORFOLK, BRISTOL AND PLYMOUTH",Incumbent,Pending,100133.35
"CICCOLO, MICHELLE",DEMOCRATIC,MA,HOUSE DISTRICT FIFTEENTH MIDDLESEX,Open,Pending,99017.00
"JONES JR, BRADLEY H",REPUBLICAN,MA,HOUSE DISTRICT TWENTIETH MIDDLESEX,Incumbent,Pending,98301.74
"NANGLE, DAVID",DEMOCRATIC,MA,HOUSE DISTRICT SEVENTEENTH MIDDLESEX,Incumbent,Pending,94744.18
"BROWNSBERGER, WILLIAM N",DEMOCRATIC,MA,SENATE DISTRICT SECOND SUFFOLK AND MIDDLESEX,Incumbent,Pending,92226.10
"MCMAHON III, JAMES R",REPUBLICAN,MA,ATTORNEY GENERAL,Challenger,Pending,91477.73
"BARRETT, MICHAEL J",DEMOCRATIC,MA,SENATE DISTRICT THIRD MIDDLESEX,Incumbent,Pending,90648.51
"LYONS JR, JAMES J",REPUBLICAN,MA,HOUSE DISTRICT EIGHTEENTH ESSEX,Incumbent,Pending,90078.22
"HONAN, KEVIN G",DEMOCRATIC,MA,HOUSE DISTRICT SEVENTEENTH SUFFOLK,Incumbent,Pending,88810.00
"CROCKER JR, WILLIAM L",REPUBLICAN,MA,HOUSE DISTRICT SECOND BARNSTABLE,Incumbent,Pending,86919.69
"CUSACK, MARK JAMES",DEMOCRATIC,MA,HOUSE DISTRICT FIFTH NORFOLK,Incumbent,Pending,86505.00
"HOGAN, KATE",DEMOCRATIC,MA,HOUSE DISTRICT THIRD MIDDLESEX,Incumbent,Pending,85959.39
"KANE, HANNAH E",REPUBLICAN,MA,HOUSE DISTRICT ELEVENTH WORCESTER,Incumbent,Pending,85861.68
"NAUGHTON JR, HAROLD P",DEMOCRATIC,MA,HOUSE DISTRICT TWELFTH WORCESTER,Incumbent,Pending,85086.66
"HUNT, DANIEL J",DEMOCRATIC,MA,HOUSE DISTRICT THIRTEENTH SUFFOLK,Incumbent,Pending,85027.03
"CRONIN, CLAIRE D",DEMOCRATIC,MA,HOUSE DISTRICT ELEVENTH PLYMOUTH,Incumbent,Pending,84871.00
"IANNELLA JR, CHRISTOPHER",DEMOCRATIC,MA,EXECUTIVE COUNCILOR DISTRICT 004,Incumbent,Pending,84503.94
"FIOLA, CAROLE A",DEMOCRATIC,MA,HOUSE DISTRICT SIXTH BRISTOL,Incumbent,Pending,84436.36
"KELCOURSE, JAMES",REPUBLICAN,MA,HOUSE DISTRICT FIRST ESSEX,Incumbent,Pending,83514.04
"RYAN, DANIEL JOSEPH",DEMOCRATIC,MA,HOUSE DISTRICT SECOND SUFFOLK,Incumbent,Pending,81994.00
"DECKER, MARJORIE C",DEMOCRATIC,MA,HOUSE DISTRICT TWENTY-FIFTH MIDDLESEX,Incumbent,Pending,80720.00
"CONNOLLY, MIKE",DEMOCRATIC,MA,HOUSE DISTRICT TWENTY-SIXTH MIDDLESEX,Incumbent,Pending,80089.60
"OCONNOR, PATRICK MICHAEL",REPUBLICAN,MA,SENATE DISTRICT PLYMOUTH AND NORFOLK,Incumbent,Pending,79834.05
"PUPPOLO JR, ANGELO J",DEMOCRATIC,MA,HOUSE DISTRICT TWELFTH HAMPDEN,Incumbent,Pending,78636.39
"ORRALL, KEIKO M",REPUBLICAN,MA,TREASURER,Challenger,Pending,76969.39
"DEMACEDO, VIRIATO MANUEL (VINNY)",REPUBLICAN,MA,SENATE DISTRICT PLYMOUTH AND BARNSTABLE,Incumbent,Pending,76949.62
"ARCIERO, JAMES",DEMOCRATIC,MA,HOUSE DISTRICT SECOND MIDDLESEX,Incumbent,Pending,76608.00
"RAUSCH, REBECCA L",DEMOCRATIC,MA,"SENATE DISTRICT NORFOLK, BRISTOL AND MIDDLESEX",Challenger,Pending,76412.82
"BENSON, JENNIFER E",DEMOCRATIC,MA,HOUSE DISTRICT THIRTY-SEVENTH MIDDLESEX,Incumbent,Pending,76020.79
"COPPINGER, EDWARD F",DEMOCRATIC,MA,HOUSE DISTRICT TENTH SUFFOLK,Incumbent,Pending,76010.00
"CAPANO, PETER L",DEMOCRATIC,MA,HOUSE DISTRICT ELEVENTH ESSEX,Open,Pending,73605.00
"CULLINANE, DAN",DEMOCRATIC,MA,HOUSE DISTRICT TWELFTH SUFFOLK,Incumbent,Pending,73224.00
"MCMURTRY, PAUL",DEMOCRATIC,MA,HOUSE DISTRICT ELEVENTH NORFOLK,Incumbent,Pending,72299.00
"KEARNEY, PATRICK JOSEPH",DEMOCRATIC,MA,HOUSE DISTRICT FOURTH PLYMOUTH,Open,Pending,70829.00
"RUSH, MICHAEL F",DEMOCRATIC,MA,SENATE DISTRICT NORFOLK & SUFFOLK,Incumbent,Pending,70654.67
"SCHMID III, PAUL A",DEMOCRATIC,MA,HOUSE DISTRICT EIGHTH BRISTOL,Incumbent,Pending,70458.34
"LOVELY, JOAN B",DEMOCRATIC,MA,SENATE DISTRICT SECOND ESSEX,Incumbent,Pending,69928.80
"HADDAD, PATRICIA A",DEMOCRATIC,MA,HOUSE DISTRICT FIFTH BRISTOL,Incumbent,Pending,69512.04
"FLORES, JOHN G",REPUBLICAN,MA,SENATE DISTRICT CAPE AND ISLANDS,Challenger,Pending,69351.50
"WHELAN, TIMOTHY R",REPUBLICAN,MA,HOUSE DISTRICT FIRST BARNSTABLE,Incumbent,Pending,67892.47
"BIELE, DAVID",DEMOCRATIC,MA,HOUSE DISTRICT FOURTH SUFFOLK,Open,Pending,65838.18
"GUSTAVSON, ALLISON M",DEMOCRATIC,MA,HOUSE DISTRICT FOURTH ESSEX,Challenger,Pending,64932.64
"OCONNELL, SHAUNNA L",REPUBLICAN,MA,HOUSE DISTRICT THIRD BRISTOL,Incumbent,Pending,63938.58
"TUCKER, PAUL F",DEMOCRATIC,MA,HOUSE DISTRICT SEVENTH ESSEX,Incumbent,Pending,63791.72
"TRAN, DEAN A",REPUBLICAN,MA,SENATE DISTRICT WORCESTER AND MIDDLESEX,Incumbent,Pending,59355.36
"MCGONAGLE JR, JOSEPH W",DEMOCRATIC,MA,HOUSE DISTRICT TWENTY-EIGHTH MIDDLESEX,Incumbent,Pending,58575.00
"MINICUCCI, CHRISTINA A",DEMOCRATIC,MA,HOUSE DISTRICT FOURTEENTH ESSEX,Open,Pending,57893.00
"FEENEY, PAUL R",DEMOCRATIC,MA,SENATE DISTRICT BRISTOL AND NORFOLK,Incumbent,Pending,56350.00
"GOBI, ANNE",DEMOCRATIC,MA,"SENATE DISTRICT WORCESTER, HAMPDEN, HAMPSHIRE AND MIDDLESEX",Incumbent,Pending,55794.00
"DEPALO, PAUL M",DEMOCRATIC,MA,EXECUTIVE COUNCILOR DISTRICT 007,Challenger,Pending,55565.37
"FERRANTE, ANN-MARGARET",DEMOCRATIC,MA,HOUSE DISTRICT FIFTH ESSEX,Incumbent,Pending,54139.00
"MESCHINO, JOAN",DEMOCRATIC,MA,HOUSE DISTRICT THIRD PLYMOUTH,Incumbent,Pending,54060.00
"ROY, JEFFREY N",DEMOCRATIC,MA,HOUSE DISTRICT TENTH NORFOLK,Incumbent,Pending,53793.16
"DAY, MICHAEL S",DEMOCRATIC,MA,HOUSE DISTRICT THIRTY-FIRST MIDDLESEX,Incumbent,Pending,53144.22
"WERDER, ALLISON P",REPUBLICAN,MA,HOUSE DISTRICT SECOND HAMPDEN,Challenger,Pending,52025.00
"HAGGERTY, RICHARD M",DEMOCRATIC,MA,HOUSE DISTRICT THIRTIETH MIDDLESEX,Open,Pending,51911.00
"CABRAL, ANTONIO F D",DEMOCRATIC,MA,HOUSE DISTRICT THIRTEENTH BRISTOL,Incumbent,Pending,51675.00
"MURADIAN JR, DAVID K",REPUBLICAN,MA,HOUSE DISTRICT NINTH WORCESTER,Incumbent,Pending,51485.00
"DOOLEY, SHAWN",REPUBLICAN,MA,HOUSE DISTRICT NINTH NORFOLK,Incumbent,Pending,50374.00
"MCBRINE, KATIE L",DEMOCRATIC,MA,SENATE DISTRICT PLYMOUTH AND NORFOLK,Challenger,Pending,49784.10
"MIRANDA, LIZ",DEMOCRATIC,MA,HOUSE DISTRICT FIFTH SUFFOLK,Open,Pending,49611.25
"MAHONEY, JOHN J",DEMOCRATIC,MA,HOUSE DISTRICT THIRTEENTH WORCESTER,Incumbent,Pending,49140.00
"PIGNATELLI, WILLIAM (SMITTY)",DEMOCRATIC,MA,HOUSE DISTRICT FOURTH BERKSHIRE,Incumbent,Pending,49050.00
"BRODEUR, PAUL",DEMOCRATIC,MA,HOUSE DISTRICT THIRTY-SECOND MIDDLESEX,Incumbent,Pending,48610.00
"HURLEY, MARY E",DEMOCRATIC,MA,EXECUTIVE COUNCILOR DISTRICT 008,Incumbent,Pending,47553.45
"SILVIA, ALAN D",DEMOCRATIC,MA,HOUSE DISTRICT SEVENTH BRISTOL,Incumbent,Pending,47485.00
"LIVINGSTONE, JAY",DEMOCRATIC,MA,HOUSE DISTRICT EIGHTH SUFFOLK,Incumbent,Pending,47295.00
"WILLIAMS, BUD L",DEMOCRATIC,MA,HOUSE DISTRICT ELEVENTH HAMPDEN,Incumbent,Pending,47125.00
"AYERS, BRUCE J",DEMOCRATIC,MA,HOUSE DISTRICT FIRST NORFOLK,Incumbent,Pending,46390.00
"STANLEY, THOMAS M",DEMOCRATIC,MA,HOUSE DISTRICT NINTH MIDDLESEX,Incumbent,Pending,46018.92
"GOUVEIA, TAMI L",DEMOCRATIC,MA,HOUSE DISTRICT FOURTEENTH MIDDLESEX,Open,Pending,45570.83
"BARBER, CHRISTINE P",DEMOCRATIC,MA,HOUSE DISTRICT THIRTY-FOURTH MIDDLESEX,Incumbent,Pending,45172.61
"PEAKE, SARAH K",DEMOCRATIC,MA,HOUSE DISTRICT FOURTH BARNSTABLE,Incumbent,Pending,44822.98
"VITOLO, TOMMY",DEMOCRATIC,MA,HOUSE DISTRICT FIFTEENTH NORFOLK,Open,Pending,44801.00
"ODAY, JAMES J",DEMOCRATIC,MA,HOUSE DISTRICT FOURTEENTH WORCESTER,Incumbent,Pending,44715.00
"KENNEDY, EDWARD J",DEMOCRATIC,MA,SENATE DISTRICT FIRST MIDDLESEX,Open,Pending,44620.00
"MARK, PAUL W",DEMOCRATIC,MA,HOUSE DISTRICT SECOND BERKSHIRE,Incumbent,Pending,44423.60
"SANTIAGO, JON",DEMOCRATIC,MA,HOUSE DISTRICT NINTH SUFFOLK,Open,Pending,44335.00
"MURPHY, JAMES",DEMOCRATIC,MA,HOUSE DISTRICT FOURTH NORFOLK,Incumbent,Pending,43625.00
"BRADY, MICHAEL D",DEMOCRATIC,MA,SENATE DISTRICT SECOND PLYMOUTH AND BRISTOL,Incumbent,Pending,42811.66
"PETROLATI, THOMAS M",DEMOCRATIC,MA,HOUSE DISTRICT SEVENTH HAMPDEN,Incumbent,Pending,42242.02
"BLAIS, NATALIE M",DEMOCRATIC,MA,HOUSE DISTRICT FIRST FRANKLIN,Open,Pending,41691.00
"STRAUS, WILLIAM M",DEMOCRATIC,MA,HOUSE DISTRICT TENTH BRISTOL,Incumbent,Pending,41327.93
"VEGA, AARON",DEMOCRATIC,MA,HOUSE DISTRICT FIFTH HAMPDEN,Incumbent,Pending,41313.81
"SCACCIA, ANGELO M",DEMOCRATIC,MA,HOUSE DISTRICT FOURTEENTH SUFFOLK,Incumbent,Pending,41031.34
"HILL, BRADFORD R",REPUBLICAN,MA,HOUSE DISTRICT FOURTH ESSEX,Incumbent,Pending,40346.12
"MALIA, ELIZABETH A",DEMOCRATIC,MA,HOUSE DISTRICT ELEVENTH SUFFOLK,Incumbent,Pending,40170.00
"CHALIFOUX-ZEPHIR, SUSAN A",DEMOCRATIC,MA,SENATE DISTRICT WORCESTER AND MIDDLESEX,Challenger,Pending,40025.00
"CUTLER, JOSH S",DEMOCRATIC,MA,HOUSE DISTRICT SIXTH PLYMOUTH,Incumbent,Pending,39633.00
"PARISELLA, JERALD A",DEMOCRATIC,MA,HOUSE DISTRICT SIXTH ESSEX,Incumbent,Pending,39050.00
"SOTER, MICHAEL J",REPUBLICAN,MA,HOUSE DISTRICT EIGHTH WORCESTER,Open,Pending,36772.41
"ECKERT, CHRISTINA",DEMOCRATIC,MA,HOUSE DISTRICT SECOND ESSEX,Challenger,Pending,36634.00
"FERREIRA, JOSEPH C",DEMOCRATIC,MA,EXECUTIVE COUNCILOR DISTRICT 001,Incumbent,Pending,36410.00
"CUSACK, PAUL J",DEMOCRATIC,MA,HOUSE DISTRICT SECOND BARNSTABLE,Challenger,Pending,36360.00
"CREEM, CYNTHIA STONE",DEMOCRATIC,MA,SENATE DISTRICT FIRST MIDDLESEX AND NORFOLK,Incumbent,Pending,36314.00
"KAFKA, LOUIS L",DEMOCRATIC,MA,HOUSE DISTRICT EIGHTH NORFOLK,Incumbent,Pending,35100.42
"HALL, JULIE A",REPUBLICAN,MA,HOUSE DISTRICT SECOND BRISTOL,Challenger,Pending,34657.65
"FRIEDMAN, CINDY F",DEMOCRATIC,MA,SENATE DISTRICT FOURTH MIDDLESEX,Incumbent,Pending,34514.00
"MURATORE, MATHEW J",REPUBLICAN,MA,HOUSE DISTRICT FIRST PLYMOUTH,Incumbent,Pending,34446.29
"SPELIOTIS, THEODORE C",DEMOCRATIC,MA,HOUSE DISTRICT THIRTEENTH ESSEX,Incumbent,Pending,34445.06
"SABADOSA, LINDSAY N",DEMOCRATIC,MA,HOUSE DISTRICT FIRST HAMPSHIRE,Open,Pending,33818.41
"FERNANDES, DYLAN A",DEMOCRATIC,MA,"HOUSE DISTRICT BARNSTABLE, DUKES AND NANTUCKET",Incumbent,Pending,33502.00
"BEZANSON, ALEX A",DEMOCRATIC,MA,HOUSE DISTRICT SEVENTH PLYMOUTH,Open,Pending,32933.00
"GORDON, KENNETH",DEMOCRATIC,MA,HOUSE DISTRICT TWENTY-FIRST MIDDLESEX,Incumbent,Pending,32584.87
"LEWIS, JACK PATRICK",DEMOCRATIC,MA,HOUSE DISTRICT SEVENTH MIDDLESEX,Incumbent,Pending,32559.00
"LEBOEUF, DAVID HENRY ARGOSKY",DEMOCRATIC,MA,HOUSE DISTRICT SEVENTEENTH WORCESTER,Open,Pending,32039.26
"WONG, DONALD H",REPUBLICAN,MA,HOUSE DISTRICT NINTH ESSEX,Incumbent,Pending,31975.62
"GARRY, COLLEEN",DEMOCRATIC,MA,HOUSE DISTRICT THIRTY-SIXTH MIDDLESEX,Incumbent,Pending,31935.00
"DUFF, EILEEN R",DEMOCRATIC,MA,EXECUTIVE COUNCILOR DISTRICT 005,Incumbent,Pending,31672.31
"LAWN JR, JOHN J",DEMOCRATIC,MA,HOUSE DISTRICT TENTH MIDDLESEX,Incumbent,Pending,31487.16
"DOMB, MINDY",DEMOCRATIC,MA,HOUSE DISTRICT THIRD HAMPSHIRE,Open,Pending,31390.00
"DRISCOLL JR, WILLIAM J",DEMOCRATIC,MA,HOUSE DISTRICT SEVENTH NORFOLK,Incumbent,Pending,31101.75
"DEVANEY, MARILYN PETITTO",DEMOCRATIC,MA,EXECUTIVE COUNCILOR DISTRICT 003,Incumbent,Pending,31000.00
"TOSADO, JOSE F",DEMOCRATIC,MA,HOUSE DISTRICT NINTH HAMPDEN,Incumbent,Pending,30840.00
"HUMASON JR, DONALD F",REPUBLICAN,MA,SENATE DISTRICT SECOND HAMPDEN AND HAMPSHIRE,Incumbent,Pending,30500.00
"SULLIVAN, ALYSON M",REPUBLICAN,MA,HOUSE DISTRICT SEVENTH PLYMOUTH,Open,Pending,30350.06
"HOWITT, STEVEN S",REPUBLICAN,MA,HOUSE DISTRICT FOURTH BRISTOL,Incumbent,Pending,29596.77
"MACDONALD, JOHN A",REPUBLICAN,MA,SENATE DISTRICT FIRST MIDDLESEX,Open,Pending,29567.00
"CASSIDY, GERARD J",DEMOCRATIC,MA,HOUSE DISTRICT NINTH PLYMOUTH,Incumbent,Pending,29305.00
"ROGERS, JOHN H",DEMOCRATIC,MA,HOUSE DISTRICT TWELFTH NORFOLK,Incumbent,Pending,29262.19
"AMORE, ANTHONY M",REPUBLICAN,MA,SECRETARY OF STATE,Challenger,Pending,29237.08
"CAHILL, DANIEL F",DEMOCRATIC,MA,HOUSE DISTRICT TENTH ESSEX,Incumbent,Pending,28737.55
"MEROLLI, THOMAS M",DEMOCRATIC,MA,SENATE DISTRICT WORCESTER AND NORFOLK,Challenger,Pending,28114.09
"DONAHUE, DANIEL",DEMOCRATIC,MA,HOUSE DISTRICT SIXTEENTH WORCESTER,Incumbent,Pending,28050.18
"ASHE, BRIAN MICHAEL",DEMOCRATIC,MA,HOUSE DISTRICT SECOND HAMPDEN,Incumbent,Pending,27920.00
"EHRLICH, LORI A",DEMOCRATIC,MA,HOUSE DISTRICT EIGHTH ESSEX,Incumbent,Pending,27858.00
"FINN, MICHAEL J",DEMOCRATIC,MA,HOUSE DISTRICT SIXTH HAMPDEN,Incumbent,Pending,27605.00
"STRAUSS, JEAN ANNE",DEMOCRATIC,MA,HOUSE DISTRICT FIFTH WORCESTER,Challenger,Pending,27343.01
"GREGOIRE, DANIELLE W",DEMOCRATIC,MA,HOUSE DISTRICT FOURTH MIDDLESEX,Incumbent,Pending,27163.05
"FISHMAN, DANIEL",LIBERTARIAN,MA,AUDITOR,Challenger,Pending,27149.45
"ULTRINO, STEVEN ROCCO",DEMOCRATIC,MA,HOUSE DISTRICT THIRTY-THIRD MIDDLESEX,Incumbent,Pending,26755.74
"ZLOTNIK, JONATHAN D",DEMOCRATIC,MA,HOUSE DISTRICT SECOND WORCESTER,Incumbent,Pending,26613.00
"PEISCH, ALICE HANLON",DEMOCRATIC,MA,HOUSE DISTRICT FOURTEENTH NORFOLK,Incumbent,Pending,26492.41
"HENDRICKS, CHRISTOPHER",DEMOCRATIC,MA,HOUSE DISTRICT ELEVENTH BRISTOL,Open,Pending,25849.65
"DECOSTE, DAVID F",REPUBLICAN,MA,HOUSE DISTRICT FIFTH PLYMOUTH,Incumbent,Pending,25280.00
"VINCENT, ROSELEE",DEMOCRATIC,MA,HOUSE DISTRICT SIXTEENTH SUFFOLK,Incumbent,Pending,25203.89
"BOLDYGA, NICHOLAS (NICK)",REPUBLICAN,MA,HOUSE DISTRICT THIRD HAMPDEN,Incumbent,Pending,24601.00
"BRADY, HELEN",REPUBLICAN,MA,AUDITOR,Challenger,Pending,24312.94
"GALVIN, WILLIAM C",DEMOCRATIC,MA,HOUSE DISTRICT SIXTH NORFOLK,Incumbent,Pending,24275.00
"KENNEDY, TERRENCE W",DEMOCRATIC,MA,EXECUTIVE COUNCILOR DISTRICT 006,Incumbent,Pending,24005.25
"LOMBARDO, MARC T",REPUBLICAN,MA,HOUSE DISTRICT TWENTY-SECOND MIDDLESEX,Incumbent,Pending,23940.00
"VELIS, JOHN C",DEMOCRATIC,MA,HOUSE DISTRICT FOURTH HAMPDEN,Incumbent,Pending,23898.55
"SMOLA, TODD M",REPUBLICAN,MA,HOUSE DISTRICT FIRST HAMPDEN,Incumbent,Pending,23760.00
"RUDOLF, DEBORAH A",DEMOCRATIC,MA,SENATE DISTRICT PLYMOUTH AND BARNSTABLE,Challenger,Pending,23452.00
"DEMILIA, ANGELO L",REPUBLICAN,MA,HOUSE DISTRICT EIGHTH PLYMOUTH,Incumbent,Pending,23435.00
"HAWKINS, JAMES K",DEMOCRATIC,MA,HOUSE DISTRICT SECOND BRISTOL,Incumbent,Pending,23318.67
"VENTURA, JACOB J",REPUBLICAN,MA,SENATE DISTRICT BRISTOL AND NORFOLK,Challenger,Pending,22850.00
"HEWINS, SARAH G",DEMOCRATIC,MA,HOUSE DISTRICT SECOND PLYMOUTH,Challenger,Pending,22843.50
"MURRAY, BRIAN W",DEMOCRATIC,MA,HOUSE DISTRICT TENTH WORCESTER,Incumbent,Pending,22665.00
"MEZZINA, MARK B",REPUBLICAN,MA,HOUSE DISTRICT THIRTEENTH ESSEX,Challenger,Pending,22665.00
"ROSS, RICHARD",REPUBLICAN,MA,"SENATE DISTRICT NORFOLK, BRISTOL AND MIDDLESEX",Incumbent,Pending,22550.00
"BALSER, RUTH B",DEMOCRATIC,MA,HOUSE DISTRICT TWELFTH MIDDLESEX,Incumbent,Pending,22033.60
"HIGGINS, NATALIE",DEMOCRATIC,MA,HOUSE DISTRICT FOURTH WORCESTER,Incumbent,Pending,21776.58
"FARLEY-BOUVIER, TRICIA",DEMOCRATIC,MA,HOUSE DISTRICT THIRD BERKSHIRE,Incumbent,Pending,21556.00
"COLARUSSO, CAROLINE",REPUBLICAN,MA,HOUSE DISTRICT THIRTY-FIRST MIDDLESEX,Challenger,Pending,21045.00
"WALSH, THOMAS P",DEMOCRATIC,MA,HOUSE DISTRICT TWELFTH ESSEX,Incumbent,Pending,20627.54
"HUNT, RANDY",REPUBLICAN,MA,HOUSE DISTRICT FIFTH BARNSTABLE,Incumbent,Pending,20410.00
"HAY, STEPHAN",DEMOCRATIC,MA,HOUSE DISTRICT THIRD WORCESTER,Incumbent,Pending,20234.00
"GARBALLEY, SEAN",DEMOCRATIC,MA,HOUSE DISTRICT TWENTY-THIRD MIDDLESEX,Incumbent,Pending,19616.18
"PRINZIVALLI, PINA",REPUBLICAN,MA,HOUSE DISTRICT NINETEENTH MIDDLESEX,Open,Pending,19335.00
"DEVERS, MARCOS A",DEMOCRATIC,MA,HOUSE DISTRICT SIXTEENTH ESSEX,Open,Pending,19275.00
"CAREY, DANIEL R",DEMOCRATIC,MA,HOUSE DISTRICT SECOND HAMPSHIRE,Open,Pending,19268.17
"LANATRA, KATHLEEN R",DEMOCRATIC,MA,HOUSE DISTRICT TWELFTH PLYMOUTH,Open,Pending,19258.44
"ROCCO-RUNNION, JENNIFER A",DEMOCRATIC,MA,HOUSE DISTRICT FIRST ESSEX,Challenger,Pending,19141.00
"FROST, PAUL K",REPUBLICAN,MA,HOUSE DISTRICT SEVENTH WORCESTER,Incumbent,Pending,18603.03
"CASEY, PATRICK R",REPUBLICAN,MA,HOUSE DISTRICT TENTH NORFOLK,Challenger,Pending,18163.22
"ROGERS, DAVID M",DEMOCRATIC,MA,HOUSE DISTRICT TWENTY-FOURTH MIDDLESEX,Incumbent,Pending,17535.00
"MOM, RADY",DEMOCRATIC,MA,HOUSE DISTRICT EIGHTEENTH MIDDLESEX,Incumbent,Pending,17299.01
"CAISSIE, JENNIE L",REPUBLICAN,MA,EXECUTIVE COUNCILOR DISTRICT 007,Incumbent,Pending,17200.00
"MONTIGNY, MARK",DEMOCRATIC,MA,SENATE DISTRICT SECOND BRISTOL AND PLYMOUTH,Incumbent,Pending,16780.63
"STEINHOF, DAVID L",REPUBLICAN,MA,HOUSE DISTRICT SIXTH BRISTOL,Challenger,Pending,16620.00
"CAMPBELL, LINDA DEAN",DEMOCRATIC,MA,HOUSE DISTRICT FIFTEENTH ESSEX,Incumbent,Pending,16470.00
"STANTON, JACK",DEMOCRATIC,MA,HOUSE DISTRICT FIFTH BARNSTABLE,Challenger,Pending,16112.58
"KEEFE, MARY S",DEMOCRATIC,MA,HOUSE DISTRICT FIFTEENTH WORCESTER,Incumbent,Pending,16086.06
"MORAN, FRANK A",DEMOCRATIC,MA,HOUSE DISTRICT SEVENTEENTH ESSEX,Incumbent,Pending,15732.68
"LOSCO, RYAN R",REPUBLICAN,MA,HOUSE DISTRICT FOURTEENTH ESSEX,Open,Pending,15625.00
"FERRO, PAUL R",REPUBLICAN,MA,HOUSE DISTRICT FOURTH MIDDLESEX,Challenger,Pending,15152.60
"ARUTE, KRISTEN G",REPUBLICAN,MA,HOUSE DISTRICT THIRD PLYMOUTH,Challenger,Pending,15135.00
"VIEIRA, DAVID T",REPUBLICAN,MA,HOUSE DISTRICT THIRD BARNSTABLE,Incumbent,Pending,14400.00
"MAHONEY JR, JOHN T",DEMOCRATIC,MA,HOUSE DISTRICT FIRST PLYMOUTH,Challenger,Pending,14195.00
"FULLEN, PAUL J",REPUBLICAN,MA,HOUSE DISTRICT SEVENTEENTH WORCESTER,Open,Pending,14130.00
"JEHLEN, PATRICIA D",DEMOCRATIC,MA,SENATE DISTRICT SECOND MIDDLESEX,Incumbent,Pending,13910.58
"POIRIER, ELIZABETH A",REPUBLICAN,MA,HOUSE DISTRICT FOURTEENTH BRISTOL,Incumbent,Pending,13830.93
"MIRRA, LEONARD",REPUBLICAN,MA,HOUSE DISTRICT SECOND ESSEX,Incumbent,Pending,13668.18
"LYNCH, KATHLEEN",REPUBLICAN,MA,HOUSE DISTRICT SECOND MIDDLESEX,Challenger,Pending,13268.10
"GENTILE, CARMINE LAWRENCE",DEMOCRATIC,MA,HOUSE DISTRICT THIRTEENTH MIDDLESEX,Incumbent,Pending,12960.00
"GIFFORD, SUSAN",REPUBLICAN,MA,HOUSE DISTRICT SECOND PLYMOUTH,Incumbent,Pending,12745.00
"ORRALL, NORMAN J",REPUBLICAN,MA,HOUSE DISTRICT TWELFTH BRISTOL,Open,Pending,12725.09
"HALL, STEVEN R",REPUBLICAN,MA,"SENATE DISTRICT WORCESTER, HAMPDEN, HAMPSHIRE AND MIDDLESEX",Challenger,Pending,12570.00
"DUBOIS, MICHELLE MARIE",DEMOCRATIC,MA,HOUSE DISTRICT TENTH PLYMOUTH,Incumbent,Pending,12411.44
"TYLER, CHYNAH",DEMOCRATIC,MA,HOUSE DISTRICT SEVENTH SUFFOLK,Incumbent,Pending,12332.78
"CHANG-DIAZ, SONIA",DEMOCRATIC,MA,SENATE DISTRICT SECOND SUFFOLK,Incumbent,Pending,12035.00
"CRESCENZO, MATTHEW",DEMOCRATIC,MA,HOUSE DISTRICT NINTH ESSEX,Challenger,Pending,11931.00
"OCONNELL, EDWARD J",REPUBLICAN,MA,HOUSE DISTRICT FOURTH PLYMOUTH,Open,Pending,11681.88
"PROVOST, DENISE",DEMOCRATIC,MA,HOUSE DISTRICT TWENTY-SEVENTH MIDDLESEX,Incumbent,Pending,11643.47
"NESLUSAN, TANYA V",DEMOCRATIC,MA,HOUSE DISTRICT FIRST HAMPDEN,Challenger,Pending,11523.09
"VARGAS, ANDRES X",DEMOCRATIC,MA,HOUSE DISTRICT THIRD ESSEX,Incumbent,Pending,11400.00
"PALMIERI, RICHARD E",REPUBLICAN,MA,HOUSE DISTRICT FOURTH WORCESTER,Challenger,Pending,11230.00
"HARRINGTON, SHEILA C",REPUBLICAN,MA,HOUSE DISTRICT FIRST MIDDLESEX,Incumbent,Pending,11095.00
"MALONE, PATRICK J",DEMOCRATIC,MA,HOUSE DISTRICT EIGHTH WORCESTER,Open,Pending,11065.08
"MCKENNA, JOSEPH D",REPUBLICAN,MA,HOUSE DISTRICT EIGHTEENTH WORCESTER,Incumbent,Pending,9850.00
"FRAWLEY, ALLIN JOHN",DEMOCRATIC,MA,HOUSE DISTRICT TWELFTH BRISTOL,Open,Pending,9350.00
"BAKER, RICHARD A",REPUBLICAN,MA,EXECUTIVE COUNCILOR DISTRICT 005,Challenger,Pending,9136.36
"GRAVEL, EDWARD A",REPUBLICAN,MA,HOUSE DISTRICT SECOND WORCESTER,Challenger,Pending,8971.76
"CALVO-BACCI, ERIN K",REPUBLICAN,MA,SENATE DISTRICT FIFTH MIDDLESEX,Challenger,Pending,8533.00
"ROBERTSON, DAVID ALLEN",DEMOCRATIC,MA,HOUSE DISTRICT NINETEENTH MIDDLESEX,Open,Pending,8440.00
"TOUGAS, STEPHEN F",REPUBLICAN,MA,HOUSE DISTRICT THIRD NORFOLK,Challenger,Pending,7811.14
"LEIBOWITZ, STEVEN",DEMOCRATIC,MA,HOUSE DISTRICT FIRST BARNSTABLE,Challenger,Pending,7662.24
"BIAGETTI, SANDRA E SLATTERY",REPUBLICAN,MA,HOUSE DISTRICT TENTH WORCESTER,Challenger,Pending,7042.00
"KEENAN, JOHN F",DEMOCRATIC,MA,SENATE DISTRICT NORFOLK AND PLYMOUTH,Incumbent,Pending,6895.23
"HAMLIN, BRIAN P",DEMOCRATIC,MA,HOUSE DISTRICT NINTH NORFOLK,Challenger,Pending,6771.80
"DYKEMA, CAROLYN C",DEMOCRATIC,MA,HOUSE DISTRICT EIGHTH MIDDLESEX,Incumbent,Pending,6664.50
"LECZYNSKI, RAYMOND G",REPUBLICAN,MA,HOUSE DISTRICT THIRTY-SIXTH MIDDLESEX,Challenger,Pending,6660.00
"BARRETT III, JOHN",DEMOCRATIC,MA,HOUSE DISTRICT FIRST BERKSHIRE,Incumbent,Pending,6375.00
"TRUSCHELLI, JOSEPH M",REPUBLICAN,MA,HOUSE DISTRICT TWELFTH PLYMOUTH,Open,Pending,6250.00
"MCDONALD, JOHN G",REPUBLICAN,MA,HOUSE DISTRICT ELEVENTH NORFOLK,Challenger,Pending,5208.30
"ESPINOLA III, JOSEPH M",REPUBLICAN,MA,SENATE DISTRICT SECOND ESSEX AND MIDDLESEX,Open,Pending,5065.00
"FARRER, EMILY JM",DEMOCRATIC,MA,HOUSE DISTRICT THIRD BRISTOL,Challenger,Pending,4722.08
"MARKEY, CHRISTOPHER M",DEMOCRATIC,MA,HOUSE DISTRICT NINTH BRISTOL,Incumbent,Pending,4550.00
"BERTHIAUME JR, DONALD R",REPUBLICAN,MA,HOUSE DISTRICT FIFTH WORCESTER,Incumbent,Pending,4275.00
"FERGUSON, KIMBERLY N",REPUBLICAN,MA,HOUSE DISTRICT FIRST WORCESTER,Incumbent,Pending,3850.00
"KHAN, KAY",DEMOCRATIC,MA,HOUSE DISTRICT ELEVENTH MIDDLESEX,Incumbent,Pending,3800.00
"GONZALEZ, CARLOS",DEMOCRATIC WRITEIN,MA,HOUSE DISTRICT TENTH HAMPDEN,Incumbent,Pending,3719.52
"MERCIER, MARC C",LIBERTARIAN,MA,EXECUTIVE COUNCILOR DISTRICT 005,Challenger,Pending,3561.99
"DURANT, PETER J",REPUBLICAN,MA,HOUSE DISTRICT SIXTH WORCESTER,Incumbent,Pending,3200.00
